Name,ID,Year,Length,Age,Rating,Description
Volcano,tt0120461,1997,1h 44m,12,5.5 (84K),A volcano erupts in downtown Los Angeles and a city official and a seismologist try to stop its inevitable flow through the city.
Police Academy 2: Their First Assignment,tt0089822,1985,1h 27m,12,5.8 (60K),When a new gang moves into town it's up to the screwball police team to stop them.
Wes Craven's New Nightmare,tt0111686,1994,1h 52m,15,6.4 (66K),A demonic force has chosen Freddy Krueger as its portal to the real world. Can Heather Langenkamp play the part of Nancy one last time and trap the evil trying to enter our world?
The Santa Clause,tt0111070,1994,1h 37m,U,6.6 (136K),"When a man inadvertently makes Santa fall off his roof on Christmas Eve, he finds himself magically recruited to take his place."
Black Knight,tt0265087,2001,1h 35m,PG-13,4.9 (44K),"Martin Lawrence plays Jamal, an employee in Medieval World amusement park. After sustaining a blow to the head, he awakens to find himself in 14th century England."
Forrest Gump,tt0109830,1994,2h 22m,12,8.8 (2.3M),"The history of the United States from the 1950s to the '70s unfolds from the perspective of an Alabama man with an IQ of 75, who yearns to be reunited with his childhood sweetheart."
Titanic,tt0120338,1997,3h 14m,12,7.9 (1.3M),"A seventeen-year-old aristocrat falls in love with a kind but poor artist aboard the luxurious, ill-fated R.M.S. Titanic."
Memento,tt0209144,2000,1h 53m,15,8.4 (1.4M),"Leonard Shelby, an insurance investigator, suffers from anterograde amnesia and uses notes and tattoos to hunt for the man he thinks killed his wife, which is the last thing he remembers."
American History X,tt0120586,1998,1h 59m,18,8.5 (1.2M),"Living a life marked by violence, neo-Nazi Derek finally goes to prison after killing two black youths. Upon his release, Derek vows to change; he hopes to prevent his brother, Danny, who idolizes Derek, from following in his footsteps."
V for Vendetta,tt0434409,2005,2h 12m,15,8.1 (1.2M),"In a future British dystopian society, a shadowy freedom fighter, known only by the alias of ""V"", plots to overthrow the tyrannical government - with the help of a young woman."
GoodFellas,tt0099685,1990,2h 25m,18,8.7 (1.3M),"The story of Henry Hill and his life in the mafia, covering his relationship with his wife Karen and his mob partners Jimmy Conway and Tommy DeVito."
Iron Man,tt0371746,2008,2h 6m,12A,7.9 (1.2M),"After being held captive in an Afghan cave, billionaire engineer Tony Stark creates a unique weaponized suit of armor to fight evil."
Casino Royale,tt0381061,2006,2h 24m,15,8.0 (708K),"After earning a licence to kill, secret agent James Bond sets out on his first mission as 007. Bond must defeat a private banker funding terrorists in a high-stakes game of poker at Casino Royale, in Montenegro."
Spider-Man,tt0145487,2002,2h 1m,PG,7.4 (903K),"After being bitten by a genetically-modified spider, a shy teenager gains spider-like abilities that he uses to fight injustice as a masked superhero and face a vengeful enemy."
Pirates of the Caribbean: Dead Man's Chest,tt0383574,2006,2h 31m,12A,7.4 (784K),"Jack Sparrow races to recover the heart of Davy Jones to avoid enslaving his soul to Jones' service, as other friends and foes seek the heart for their own agenda as well."
Independence Day,tt0116629,1996,2h 25m,12,7.0 (619K),"The aliens are coming and their goal is to invade and destroy Earth. Fighting superior technology, mankind's best weapon is the will to survive."
Ocean's Eleven,tt0240772,2001,1h 56m,12,7.7 (634K),"Danny Ocean, a gangster, rounds up a gang of associates to stage a sophisticated and elaborate casino heist which involves robbing three Las Vegas casinos simultaneously during a popular boxing event."
Pirates of the Caribbean: At World's End,tt0449088,2007,2h 49m,12A,7.1 (708K),"Will Turner, Elizabeth Swann, Hector Barbossa, and the crew of the Black Pearl try and rescue Jack from davy jones locker and prepare to fight Lord Cutler Beckett, who controls Davy Jones and the Flying Dutchman."
Armageddon,tt0120591,1998,2h 31m,12,6.7 (459K),"After discovering that an asteroid the size of Texas will impact Earth in less than a month, NASA recruits a misfit team of deep-core drillers to save the planet."
Harry Potter and the Prisoner of Azkaban,tt0304141,2004,2h 22m,PG,7.9 (711K),"Harry Potter, Ron and Hermione return to Hogwarts School of Witchcraft and Wizardry for their third year of study, where they delve into the mystery surrounding an escaped prisoner who poses a dangerous threat to the young wizard."
Harry Potter and the Order of the Phoenix,tt0373889,2007,2h 18m,12A,7.5 (650K),"With their warning about Lord Voldemort's return scoffed at, Harry and Dumbledore are targeted by the Wizard authorities as an authoritarian bureaucrat slowly seizes power at Hogwarts."
E.T. the Extra-Terrestrial,tt0083866,1982,1h 55m,PG,7.9 (447K),A troubled child summons the courage to help a friendly alien escape from Earth and return to his home planet.
Mr. & Mrs. Smith,tt0356910,2005,2h,15,6.5 (555K),"A husband and wife struggle to keep their marriage alive until they realize they are both secretly working as assassins. Now, their respective assignments require them to kill each other."
"The Chronicles of Narnia: The Lion, the Witch and the Wardrobe",tt0363771,2005,2h 23m,PG,6.9 (436K),"While playing, Lucy and her siblings find a wardrobe that lands them in a mystical place called Narnia. Here they realize that it was fated and they must now unite with Aslan to defeat an evil queen."
Black Hawk Down,tt0265086,2001,2h 24m,15,7.7 (432K),"The story of 160 elite U.S. soldiers who dropped into Mogadishu in October 1993 to capture two top lieutenants of a renegade warlord, but found themselves in a desperate battle with a large force of heavily armed Somalis."
Life of Brian,tt0079470,1979,1h 34m,AA,8.0 (426K),"Born on the original Christmas in the stable next door to Jesus Christ, Brian of Nazareth spends his life being mistaken for a messiah."
The Mummy,tt0120616,1999,2h 4m,12A,7.1 (473K),"At an archaeological dig in the ancient city of Hamunaptra, an American serving in the French Foreign Legion accidentally awakens a mummy who begins to wreak havoc as he searches for the reincarnation of his long-lost love."
Quantum of Solace,tt0830515,2008,1h 46m,12A,6.5 (478K),James Bond tries to stop an organisation from eliminating a country's most valuable resource.
Meet the Parents,tt0212338,2000,1h 48m,12,7.0 (362K),"Chicago male nurse and chronic under-achiever Greg Focker meets his charming teacher girlfriend Pam Byrnes' parents Jack and Dina before proposing, but suspicious Jack is an overprotective former CIA agent - every date's worst nightmare."
The Aviator,tt0338751,2004,2h 50m,12A,7.5 (390K),A biopic depicting the early years of legendary director and aviator Howard Hughes' career from the late 1920s to the mid 1940s.
2012,tt1190080,2009,2h 38m,12A,5.8 (405K),A frustrated writer struggles to keep his family alive when a series of global catastrophes threatens to annihilate mankind.
The Passion of the Christ,tt0335345,2004,2h 7m,18,7.2 (255K),"Depicts the final twelve hours in the life of Jesus of Nazareth, on the day of his crucifixion in Jerusalem."
Ghostbusters,tt0087332,1984,1h 45m,PG,7.8 (463K),"Three parapsychologists forced out of their university funding set up shop as a unique ghost removal service in New York City, attracting frightened yet skeptical customers."
Home Alone,tt0099785,1990,1h 43m,PG,7.7 (669K),"An eight-year-old troublemaker, mistakenly left home alone, must defend his home against a pair of burglars on Christmas Eve."
Kingdom of Heaven,tt0320661,2005,2h 24m,15,7.3 (325K),"Balian of Ibelin travels to Jerusalem during the Crusades of the 12th century, and there he finds himself as the defender of the city and its people."
Speed,tt0111257,1994,1h 56m,15,7.3 (401K),A young police officer must prevent a bomb exploding aboard a city bus by keeping its speed above 50 mph.
The Thing,tt0084787,1982,1h 49m,X,8.2 (485K),A research team in Antarctica is hunted by a shape-shifting alien that assumes the appearance of its victims.
Pineapple Express,tt0910936,2008,1h 51m,18,6.9 (362K),A process server and his marijuana dealer wind up on the run from hitmen and a corrupt police officer after he witnesses his dealer's boss murder a competitor while trying to serve papers on him.
Constantine,tt0360486,2005,2h 1m,15,7.0 (384K),"Detective Angela approaches Constantine, a demon hunter, to help her investigate her twin sister's mysterious death. As he digs deeper, he realizes that demons are trying to enter the human world."
Back to the Future Part III,tt0099088,1990,1h 58m,PG,7.4 (492K),"Stranded in 1955, Marty McFly learns about the death of Doc Brown in 1885 and must travel back in time to save him. With no fuel readily available for the DeLorean, the two must figure how to escape the Old West before Emmett is murdered."
Chicago,tt0299658,2002,1h 53m,12A,7.2 (247K),"Two death-row murderesses develop a fierce rivalry while competing for publicity, celebrity, and a sleazy lawyer's attention."
Death Proof,tt1028528,2007,2h 7m,18,7.0 (320K),"Two separate sets of voluptuous women are stalked at different times by a scarred stuntman who uses his ""death proof"" cars to execute his murderous plans."
Ice Age,tt0268380,2002,1h 21m,PG,7.5 (533K),"Manny the mammoth, Sid the loquacious sloth, and Diego the sabre-toothed tiger go on a comical quest to return a human baby back to his father, across a world on the brink of an ice age."
"South Park: Bigger, Longer & Uncut",tt0158983,1999,1h 21m,15,7.7 (218K),"When Stan Marsh and his friends go see an R-rated movie, they start cursing and their parents think that Canada is to blame."
Street Fighter: The Legend of Chun-Li,tt0891592,2009,1h 36m,15,3.7 (26K),"When a child, Chun-Li sees her father being captured by wealthy gangster Bison. When she grows up, she goes into a quest for justice and bring down the criminal organization Shadaloo which is led by Bison."
Martyrs,tt1029234,2008,1h 39m,18,7.0 (111K),"A young woman's quest for revenge against the people who kidnapped and tormented her as a child leads her and a friend, who is also a victim of child abuse, on a terrifying journey into a living hell of depravity."
G.I. Joe: The Rise of Cobra,tt1046173,2009,1h 58m,12A,5.7 (217K),"An elite military unit comprised of special operatives known as G.I. Joe, operating out of The Pit, takes on an evil organization led by a notorious arms dealer."
Terminator Salvation,tt0438488,2009,1h 55m,12A,6.5 (382K),"As the machines prepare for a final attack, John Connor and a mysterious stranger delve into the heart of Skynet and uncover a terrible secret involving the annihilation of mankind."
Spider-Man 3,tt0413300,2007,2h 19m,12A,6.3 (655K),"A strange black entity from another world bonds with Peter Parker and causes inner turmoil as he contends with new villains, temptations, and revenge."
Loft,tt1606789,2010,1h 48m,N/A,6.8 (6.6K),"Five best friends, all married, decide to share a loft apartment to carry on affairs."
The Descent,tt0435625,2005,1h 39m,18,7.2 (255K),"A caving expedition goes horribly wrong, as the explorers become trapped and ultimately pursued by a strange breed of predators."
The Descent: Part 2,tt1073105,2009,1h 34m,18,5.7 (53K),"Refusing to believe her story about cave-dwelling monsters, the sole survivor of a spelunking exploration gone horribly wrong is forced to follow the authorities back into the caves where something awaits."
The Silence of the Lambs,tt0102926,1991,1h 58m,18,8.6 (1.6M),"A young F.B.I. cadet must receive the help of an incarcerated and manipulative cannibal killer to help catch another serial killer, a madman who skins his victims."
The Shining,tt0081505,1980,2h 26m,X,8.4 (1.1M),"A family heads to an isolated hotel for the winter, where a sinister presence influences the father into violence. At the same time, his psychic son sees horrifying forebodings from both the past and the future."
Casablanca,tt0034583,1942,1h 42m,U,8.5 (619K),A cynical expatriate American cafe owner struggles to decide whether or not to help his former lover and her fugitive husband escape the Nazis in French Morocco.
One Flew Over the Cuckoo's Nest,tt0073486,1975,2h 13m,X,8.7 (1.1M),"In the Fall of 1963, a Korean War veteran and criminal pleads insanity and is admitted to a mental institution, where he rallies up the scared patients against the tyrannical nurse."
Raiders of the Lost Ark,tt0082971,1981,1h 55m,PG,8.4 (1.1M),"In 1936, archaeologists and adventurers of the U.S. government hired Indiana Jones to find the Ark of the Covenant before the Nazis could obtain its extraordinary powers."
Schindler's List,tt0108052,1993,3h 15m,15,9.0 (1.5M),"In German-occupied Poland during World War II, industrialist Oskar Schindler gradually becomes concerned for his Jewish workforce after witnessing their persecution by the Nazis."
Some Like It Hot,tt0053291,1959,2h 1m,A,8.2 (289K),"After two male musicians witness a mob hit, they flee the state in an all-female band disguised as women, but further complications set in."
Blade Runner,tt0083658,1982,1h 57m,AA,8.1 (840K),A blade runner must pursue and terminate four replicants who stole a ship in space and have returned to Earth to find their creator.
Apocalypse Now,tt0078788,1979,2h 27m,X,8.4 (727K),A U.S. Army officer serving in Vietnam is tasked with assassinating a renegade Special Forces Colonel who sees himself as a god.
12 Angry Men,tt0050083,1957,1h 36m,U,9.0 (896K),The jury in a New York City murder trial is frustrated by a single member whose skeptical caution forces them to more carefully consider the evidence before jumping to a hasty verdict.
Taxi Driver,tt0075314,1976,1h 54m,18,8.2 (952K),"A mentally unstable veteran works as a nighttime taxi driver in New York City, where the perceived decadence and sleaze fuels his urge for violent action."
The Bridge on the River Kwai,tt0050212,1957,2h 41m,PG,8.1 (238K),"British POWs are forced to build a railway bridge across the river Kwai for their Japanese captors in occupied Burma, not knowing that the allied forces are planning a daring commando raid through the jungle to destroy it."
North by Northwest,tt0053125,1959,2h 16m,PG,8.3 (354K),"A New York City advertising executive goes on the run after being mistaken for a government agent by a group of foreign spies, and falls for a woman whose loyalties he begins to doubt."
Rear Window,tt0047396,1954,1h 52m,PG,8.5 (535K),A bored photographer recovering from a broken leg passes the time by watching his neighbors and begins to suspect one of them of murder.
Leon,tt0110413,1994,1h 50m,18,8.5 (1.3M),"12-year-old Mathilda is reluctantly taken in by Léon, a professional assassin, after her family is murdered. An unusual relationship forms as she becomes his protégée and learns the assassin's trade."
Citizen Kane,tt0033467,1941,1h 59m,A,8.3 (474K),"Following the death of publishing tycoon Charles Foster Kane, reporters scramble to uncover the meaning of his final utterance: 'Rosebud.'"
American Beauty,tt0169547,1999,2h 2m,18,8.3 (1.2M),A sexually frustrated suburban father has a mid-life crisis after becoming infatuated with his daughter's best friend.
As Good as It Gets,tt0119822,1997,2h 19m,15,7.7 (324K),"A single mother and waitress, a misanthropic author, and a gay artist form an unlikely friendship after the artist is assaulted in a robbery."
Singin' in the Rain,tt0045152,1952,1h 43m,U,8.3 (267K),A silent film star falls for a chorus girl just as he and his delusionally jealous screen partner are trying to make the difficult transition to talking pictures in 1920s Hollywood.
Rain Man,tt0095953,1988,2h 13m,15,8.0 (556K),"After a selfish L.A. yuppie learns his estranged father left a fortune to an autistic-savant brother in Ohio that he didn't know existed, he absconds with his brother and sets out across the country, hoping to gain a larger inheritance."
The King's Speech,tt1504320,2010,1h 58m,15,8.0 (715K),"The story of King George VI, his unexpected ascension to the throne of the British Empire in 1936, and the speech therapist who helped the unsure monarch overcome his stammer."
Avanti!,tt0068240,1972,2h 24m,X,7.2 (12K),A successful businessman goes to Italy to arrange for the return of his tycoon father's body--and discovers that Dad died with his long-time mistress.
"The Good, the Bad and the Ugly",tt0060196,1966,2h 28m,18,8.8 (832K),A bounty hunting scam joins two men in an uneasy alliance against a third in a race to find a fortune in gold buried in a remote cemetery.
Modern Times,tt0027977,1936,1h 27m,U,8.5 (266K),The Tramp struggles to live in modern industrial society with the help of a young homeless woman.
Lost in Translation,tt0335266,2003,1h 42m,15,7.7 (503K),A fading movie star falls for a lonely young woman in Tokyo.
Full Metal Jacket,tt0093058,1987,1h 56m,18,8.2 (808K),A pragmatic U.S. Marine observes the dehumanizing effects the Vietnam War has on his fellow recruits from their brutal boot camp training to the bloody street fighting in Hue.
Django Unchained,tt1853728,2012,2h 45m,18,8.5 (1.7M),"With the help of a German bounty-hunter, a freed slave sets out to rescue his wife from a brutal plantation owner in Mississippi."
Children of Men,tt0206634,2006,1h 49m,15,7.9 (540K),"In 2027, in a chaotic world in which women have somehow become infertile, a former activist agrees to help transport a miraculously pregnant woman to a sanctuary at sea."
Ratatouille,tt0382932,2007,1h 51m,PG,8.1 (858K),A rat who can cook makes an unusual alliance with a young kitchen worker at a famous Paris restaurant.
The Lives of Others,tt0405094,2006,2h 17m,15,8.4 (419K),"In 1984 East Berlin, an agent of the secret police conducting surveillance on a writer and his lover finds himself becoming increasingly absorbed by their lives."
Chinatown,tt0071315,1974,2h 10m,X,8.1 (358K),"A private detective hired to expose an adulterer in 1930s Los Angeles finds himself caught up in a web of deceit, corruption, and murder."
City of God,tt0317248,2002,2h 10m,18,8.6 (820K),"In the slums of Rio, two kids' paths diverge as one struggles to become a photographer and the other a kingpin."
To Have and Have Not,tt0037382,1944,1h 40m,Approved,7.8 (39K),"During World War II, an American expatriate helps transport a French Resistance leader and his wife to Martinique while romancing a lounge singer."
Fargo,tt0116282,1996,1h 38m,18,8.1 (741K),Minnesota car salesman Jerry Lundegaard's inept crime falls apart due to his and his henchmen's bungling and the persistent police work of the quite pregnant Marge Gunderson.
Life of Pi,tt0454876,2012,2h 7m,PG,7.9 (677K),"A young man who survives a disaster at sea is hurtled into an epic journey of adventure and discovery. While cast away, he forms an unexpected connection with another survivor: a fearsome Bengal tiger."
Slumdog Millionaire,tt1010048,2008,2h,15,8.0 (887K),"A teenager from the slums of Mumbai becomes a contestant on the show 'Kaun Banega Crorepati?' When interrogated under suspicion of cheating, he revisits his past, revealing how he had all the answers."
Vertigo,tt0052357,1958,2h 8m,PG,8.3 (437K),"A former San Francisco police detective juggles wrestling with his personal demons and becoming obsessed with the hauntingly beautiful woman he has been hired to trail, who may be deeply disturbed."
Trainspotting,tt0117951,1996,1h 33m,18,8.1 (739K),"Renton, deeply immersed in the Edinburgh drug scene, tries to clean up and get out despite the allure of drugs and the influence of friends."
Interstellar,tt0816692,2014,2h 49m,12A,8.7 (2.2M),"When Earth becomes uninhabitable in the future, a farmer and ex-NASA pilot, Joseph Cooper, is tasked to pilot a spacecraft, along with a team of researchers, to find a new planet for humans."
The Third Man,tt0041959,1949,1h 44m,PG,8.1 (186K),"Pulp novelist Holly Martins travels to shadowy, postwar Vienna, only to find himself investigating the mysterious death of an old friend, Harry Lime."
Life Is Beautiful,tt0118799,1997,1h 56m,PG,8.6 (761K),"When an open-minded Jewish waiter and his son become victims of the Holocaust, he uses a perfect mixture of will, humor and imagination to protect his son from the dangers around their camp."
Magnolia,tt0175880,1999,3h 8m,18,8.0 (334K),"An epic mosaic of interrelated characters in search of love, forgiveness and meaning in the San Fernando Valley."
The Dark Knight Rises,tt1345836,2012,2h 44m,12A,8.4 (1.9M),"Bane, an imposing terrorist, attacks Gotham City and disrupts its eight-year-long period of peace. This forces Bruce Wayne to come out of hiding and don the cape and cowl of Batman again."
Star Wars: Episode VII - The Force Awakens,tt2488496,2015,2h 18m,12A,7.8 (988K),"As a new threat to the galaxy rises, Rey, a desert scavenger, and Finn, an ex-stormtrooper, must join Han Solo and Chewbacca to search for the one hope of restoring peace."
The Hobbit: The Desolation of Smaug,tt1170358,2013,2h 41m,12A,7.8 (721K),"The dwarves, along with Bilbo Baggins and Gandalf the Grey, continue their quest to reclaim the Lonely Mountain, their homeland, from the dragon Smaug."
Mad Max: Fury Road,tt1392190,2015,2h,15,8.1 (1.1M),"In a post-apocalyptic wasteland, a woman rebels against a tyrannical ruler in search for her homeland with the aid of a group of female prisoners, a psychotic worshipper and a drifter named Max."
12 Years a Slave,tt2024544,2013,2h 14m,15,8.1 (754K),"In the antebellum United States, Solomon Northup, a free black man from upstate New York, is abducted and sold into slavery."
Indiana Jones and the Last Crusade,tt0097576,1989,2h 7m,PG,8.2 (825K),"In 1938, after his father goes missing while pursuing the Holy Grail, Indiana Jones finds himself up against the Nazis again to stop them from obtaining its powers."
"O Brother, Where Art Thou?",tt0190590,2000,1h 47m,12,7.7 (337K),"In the deep south during the 1930s, three escaped convicts search for hidden treasure while a relentless lawman pursues them."
A Beautiful Mind,tt0268978,2001,2h 15m,12,8.2 (1M),"A mathematical genius, John Nash made an astonishing discovery early in his career and stood on the brink of international acclaim. But the handsome and arrogant Nash soon found himself on a harrowing journey of self-discovery."
The Piano,tt0107822,1993,2h 1m,15,7.5 (97K),"In the mid-19th century a mute woman is sent to New Zealand along with her young daughter and prized piano for an arranged marriage to a farmer, but is soon lusted after by a farm worker."
The Insider,tt0140352,1999,2h 37m,15,7.8 (184K),A research chemist comes under personal and professional attack when he decides to appear in a 60 Minutes exposé on Big Tobacco.
L.A. Confidential,tt0119488,1997,2h 18m,18,8.2 (631K),"As corruption grows in 1950s Los Angeles, three policemen - one strait-laced, one brutal, and one sleazy - investigate a series of murders with their own brand of justice."
The Usual Suspects,tt0114814,1995,1h 46m,18,8.5 (1.2M),The sole survivor of a pier shoot-out tells the story of how a notorious criminal influenced the events that began with five criminals meeting in a seemingly random police lineup.
Cool Hand Luke,tt0061512,1967,2h 7m,A,8.0 (192K),"A laid-back Southern man is sentenced to two years in a rural prison, but refuses to conform."
Eternal Sunshine of the Spotless Mind,tt0338013,2004,1h 48m,15,8.3 (1.1M),"When their relationship turns sour, a couple undergoes a medical procedure to have each other erased from their memories forever."
City Lights,tt0021749,1931,1h 27m,U,8.5 (201K),"With the aid of a wealthy erratic tippler, a dewy-eyed tramp who has fallen in love with a sightless flower girl accumulates money to be able to help her medically."
Misery,tt0100157,1990,1h 47m,18,7.8 (244K),"After a famous author is rescued from a car crash by a fan of his novels, he comes to realize that the care he is receiving is only the beginning of a nightmare of captivity and abuse."
What's Eating Gilbert Grape,tt0108550,1993,1h 58m,12,7.7 (259K),A young man in a small Midwestern town struggles to care for his mentally-disabled younger brother and morbidly obese mother while attempting to pursue his own happiness.
The Deer Hunter,tt0077416,1978,3h 3m,X,8.1 (369K),An in-depth examination of the ways in which the Vietnam War impacts and disrupts the lives of several friends in a small steel mill town in Pennsylvania.
The Elephant Man,tt0080678,1980,2h 4m,PG,8.2 (264K),"A Victorian surgeon rescues a heavily disfigured man who is mistreated while scraping a living as a side-show freak. Behind his monstrous façade, there is revealed a person of kindness, intelligence and sophistication."
Papillon,tt0070511,1973,2h 31m,15,8.0 (141K),"A French convict in the 1930s befriends a fellow criminal as the two of them begin serving their sentence in the South American penal colony on Devil's Island, which inspires the man to plot his escape."
Lawrence of Arabia,tt0056172,1962,3h 47m,PG,8.3 (322K),"The story of T.E. Lawrence, the English officer who successfully united and led the diverse, often warring, Arab tribes during World War I in order to fight the Turks."
East of Eden,tt0048028,1955,1h 58m,PG,7.8 (50K),"Two brothers in 1910s California struggle to maintain the favor of their affectionate but strict, Bible-toting father as an old secret about their long-absent mother comes to light."
Dances with Wolves,tt0099348,1990,3h 1m,PG,8.0 (297K),A lieutenant assigned to a remote Civil War outpost starts questioning his purpose after making contact with a neighboring Sioux settlement.
Skyfall,tt1074638,2012,2h 23m,12A,7.8 (743K),"James Bond's loyalty to M is tested when her past comes back to haunt her. When MI6 comes under attack, 007 must track down and destroy the threat, no matter how personal the cost."
