Name,ID,Year,Length,Age,Rating,Description
Moulin Rouge!,tt0203009,2001,2h 7m,12A,7.6 (303K),A poor Bohemian poet in 1890s Paris falls for a beautiful courtesan and nightclub star coveted by a jealous duke.
New Kids Turbo,tt1648112,2010,1h 24m,N/A,6.4 (18K),Five friends from 'Maaskantje' are getting fired because of the economic crisis. They decide that they won't pay for anything anymore.
The Haunted Mansion,tt0338094,2003,1h 27m,PG,5.2 (58K),"A realtor and his wife and children are summoned to a mansion, which they soon discover is haunted, and while they attempt to escape, he learns an important lesson about the family he has neglected."
X-Men 2,tt0290334,2003,2h 14m,12A,7.4 (589K),"When anti-mutant Colonel William Stryker kidnaps Professor X and attacks his school, the X-Men must ally with their archenemy Magneto to stop him."
The Da Vinci Code,tt0382625,2006,2h 29m,PG-13,6.6 (466K),"A murder inside the Louvre, and clues in Da Vinci paintings, lead to the discovery of a religious mystery protected by a secret society for two thousand years, which could shake the foundations of Christianity."
Ocean's Thirteen,tt0496806,2007,2h 2m,PG,6.9 (373K),"Danny Ocean rounds up the boys for a third heist after casino owner Willy Bank double-crosses one of the original eleven, Reuben Tishkoff."
8 Mile,tt0298203,2002,1h 50m,15,7.2 (331K),"Follows a young rapper in the Detroit area, struggling with every aspect of his life; he wants to make it big but his friends and foes make this odyssey of rap harder than it may seem."
Collateral,tt0369339,2004,2h,15,7.5 (441K),A cab driver finds himself the hostage of an engaging contract killer as he makes his rounds from hit to hit during one night in Los Angeles.
The Chronicles of Riddick,tt0296572,2004,1h 59m,15,6.6 (245K),"The wanted criminal Richard Bruno Riddick arrives on a planet called Helion Prime and finds himself up against an invading empire called the Necromongers, an army that plans to convert or kill all humans in the universe."
Perfume: The Story of a Murderer,tt0396171,2006,2h 27m,15,7.5 (269K),"Jean-Baptiste Grenouille, born with a superior olfactory sense, creates the world's finest perfume. His work, however, takes a dark turn as he searches for the ultimate scent."
Get Smart,tt0425061,2008,1h 50m,12A,6.5 (231K),"Maxwell Smart, a highly intellectual but bumbling spy working for the CONTROL agency, is tasked with preventing a terrorist attack from rival spy agency KAOS."
Charlie and the Chocolate Factory,tt0367594,2005,1h 55m,PG,6.7 (541K),"Charlie, a young boy from an impoverished family, and four other kids win a tour of an amazing chocolate factory run by an imaginative chocolatier, Willy Wonka, and his staff of Oompa-Loompas."
National Treasure: Book of Secrets,tt0465234,2007,2h 4m,PG,6.5 (258K),Benjamin Gates must follow a clue left in John Wilkes Booth's diary to prove his ancestor's innocence in the assassination of Abraham Lincoln.
Starship Troopers,tt0120201,1997,2h 9m,15,7.3 (329K),"Humans, in a fascist militaristic future, wage war with giant alien bugs."
The Devil's Advocate,tt0118971,1997,2h 24m,18,7.5 (412K),An exceptionally adept Florida lawyer is offered a job at a high-end New York City law firm with a high-end boss - the biggest opportunity of his career to date.
"I, Robot",tt0343818,2004,1h 55m,12A,7.1 (587K),"In 2035, a technophobic cop investigates a crime that may have been perpetrated by a robot, which leads to a larger threat to humanity."
Scary Movie,tt0175142,2000,1h 28m,18,6.3 (296K),"A year after disposing of the body of a man they accidentally killed, a group of dumb teenagers are stalked by a bumbling serial killer."
True Lies,tt0111503,1994,2h 21m,15,7.3 (287K),"A fearless, globe-trotting, terrorist-battling secret agent has his life turned upside down when he discovers his wife might be having an affair with a used-car salesman while terrorists smuggle nuclear war heads into the United States."
Twister,tt0117998,1996,1h 53m,PG,6.5 (238K),Two storm chasers on the brink of divorce must work together to create an advanced weather alert system by putting themselves in the cross-hairs of extremely violent tornadoes.
Mulan,tt0120762,1998,1h 27m,U,7.7 (325K),"To save her father from death in the army, a young maiden secretly goes in his place and becomes one of China's greatest heroines in the process."
Untraceable,tt0880578,2008,1h 41m,18,6.2 (54K),"FBI agent Jennifer Marsh is tasked with hunting down a seemingly untraceable serial killer who posts live videos of his victims on the Internet. As time runs out, the cat and mouse chase becomes more personal."
Transporter 2,tt0388482,2005,1h 27m,15,6.3 (219K),"Transporter Frank Martin, surfaces in Miami, Florida and is implicated in the kidnapping of the young son of a powerful USA official."
Rush Hour,tt0120812,1998,1h 38m,15,7.0 (303K),"A loyal and dedicated Hong Kong Inspector teams up with a reckless and loudmouthed L.A.P.D. detective to rescue the Chinese Consul's kidnapped daughter, while trying to arrest a dangerous crime lord along the way."
Saw VI,tt1233227,2009,1h 30m,18,6.0 (129K),"Agent Strahm is dead, and FBI agent Erickson draws nearer to Hoffman. Meanwhile, a pair of insurance executives find themselves in another game set by Jigsaw."
Mad Max,tt0079501,1979,1h 28m,15,6.8 (235K),"In a self-destructing world, a vengeful Australian policeman sets out to stop a violent motorcycle gang."
Final Destination 2,tt0309593,2003,1h 30m,15,6.2 (188K),Death is stalking Kimberly Corman and multiple survivors of a deadly highway accident.
Ghost Town,tt0995039,2008,1h 42m,12A,6.7 (79K),"Bertram Pincus is a man whose people skills leave much to be desired. When Pincus dies unexpectedly, but is miraculously revived after seven minutes, he wakes up to discover that he now has the annoying ability to see ghosts."
Flightplan,tt0408790,2005,1h 38m,12A,6.3 (174K),"A bereaved woman and her daughter are flying home from Berlin to America. At 30,000 feet, the child vanishes, and nobody will admit she was ever on the plane."
Street Kings,tt0421073,2008,1h 49m,15,6.8 (123K),"An undercover cop, disillusioned by the death of his wife, is implicated in the murder of an officer and must struggle to clear himself."
Rambo,tt0462499,2008,1h 32m,18,7.0 (248K),"In Thailand, John Rambo joins a group of mercenaries to venture into war-torn Burma, and rescue a group of Christian aid workers who were kidnapped by the ruthless local infantry unit."
Pet Sematary II,tt0105128,1992,1h 40m,18,4.9 (24K),"A teenage boy and his father move to his recently-deceased mother's hometown, where they encounter the ancient Native American cemetery with the power to raise the dead."
A Knight's Tale,tt0183790,2001,2h 12m,PG,7.0 (206K),"After his master dies, a peasant squire, fueled by his desire for food and glory, creates a new identity for himself as a knight."
The Ring,tt0298130,2002,1h 55m,15,7.1 (384K),A journalist must investigate a mysterious videotape which seems to cause the death of anyone one week to the day after they view it.
Babel,tt0449467,2006,2h 23m,15,7.5 (320K),"Tragedy strikes a married couple on vacation in the Moroccan desert, which jump starts an interlocking story involving four different families."
[Rec],tt1038988,2007,1h 18m,18,7.4 (203K),A television reporter and cameraman follow emergency workers into a dark apartment building and are quickly locked inside with something terrifying.
Alexander,tt0346491,2004,2h 55m,15,5.6 (178K),"Alexander, the King of Macedonia and one of the greatest army leaders in the history of warfare, conquers much of the known world."
Not Another Teen Movie,tt0277371,2001,1h 29m,15,5.8 (119K),A sendup of all the teen movies that have accumulated in the past two decades.
The Tournament,tt0471041,2009,1h 35m,18,6.0 (36K),"A tournament is watched by dozens of wealthy men betting on which one of the 30 assassins will survive the next 24 hours ""kill or die"" and claim the USD10,000,000 prize. It takes place in an English town with plenty of CCTVs."
The Last Samurai,tt0325710,2003,2h 34m,15,7.8 (480K),"In 19th century Japan, Nathan Algren, a US army captain, is hired by the Japanese emperor to train his army in the modern warfare techniques. Captain Algren finds himself trapped in a struggle between two eras and two worlds."
Underworld: Rise of the Lycans,tt0834001,2009,1h 32m,18,6.5 (170K),"A prequel centered on the origins of the centuries-old feud between the race of aristocratic vampires and their former slaves, the Lycans."
Hitch,tt0386588,2005,1h 58m,12A,6.6 (339K),A smooth-talking man falls for a hardened columnist while helping a shy accountant woo a beautiful heiress.
What Happens in Vegas,tt1033643,2008,1h 39m,12A,6.1 (190K),"A man and a woman are compelled, for legal reasons, to live life as a couple for a limited period of time. At stake is a large amount of money."
Edward Scissorhands,tt0099487,1990,1h 45m,12,7.9 (537K),The solitary life of an artificial man - who was incompletely constructed and has scissors for hands - is upended when he is taken in by a suburban family.
The Bucket List,tt0825232,2007,1h 37m,12A,7.4 (264K),Two terminally ill men escape from a cancer ward and head off on a road trip with a wish list of to-dos before they die.
King Kong,tt0360717,2005,3h 7m,12A,7.2 (454K),"A greedy film producer assembles a team of moviemakers and sets out for the infamous Skull Island, where they find more than just cannibalistic natives."
Fantastic 4: Rise of the Silver Surfer,tt0486576,2007,1h 32m,PG,5.6 (282K),The Fantastic Four learn that they aren't the only super-powered beings in the universe when they square off against the powerful Silver Surfer and the planet-eating Galactus.
The Holiday,tt0457939,2006,2h 16m,12A,7.0 (330K),"Amanda lives in LA and is a movie trailer editor. Iris lives in Surrey and is a journalist. The two decide to swap houses for two weeks at Christmas - both trying to forget their troubled love lives, until love finds them anyways."
Ocean's Twelve,tt0349903,2004,2h 5m,12A,6.5 (421K),Daniel Ocean recruits one more team member so he can pull off three major European heists in this sequel to Ocean's Eleven (2001).
Terminator 3: Rise of the Machines,tt0181852,2003,1h 49m,12A,6.3 (424K),John Connor must face a female Terminatrix with power over all the machines. But a new T-800 unit Terminator sent back through time will guide him through the coming battle.
War of the Worlds,tt0407304,2005,1h 57m,12A,6.5 (483K),An alien invasion threatens the future of humanity. The catastrophic nightmare is depicted through the eyes of one American family fighting for survival.
Munich,tt0408306,2005,2h 44m,15,7.5 (243K),"After the Black September capture and massacre of Israeli athletes at the 1972 Olympics, five men are chosen to eliminate the people responsible for that fateful day."
Hulk,tt0286716,2003,2h 18m,12A,5.6 (282K),"Bruce Banner, a genetics researcher with a tragic past, suffers a lab accident that makes him transform into a raging, giant green monster when angered, making him a target of forces seeking to abuse his power."
Click,tt0389860,2006,1h 47m,12A,6.4 (365K),A workaholic architect finds a universal remote that allows him to fast-forward and rewind to different parts of his life. Complications arise when the remote starts to overrule his choices.
Beowulf,tt0442933,2007,1h 55m,12A,6.3 (176K),"The warrior Beowulf must fight and defeat the monster Grendel, who is terrorizing Denmark, then Grendel's Mother, who begins killing out of revenge."
The Matrix Revolutions,tt0242653,2003,2h 9m,15,6.7 (553K),The human city of Zion defends itself against the massive invasion of the machines as Neo fights to end the war at another front while also opposing the rogue Agent Smith.
Batman Forever,tt0112462,1995,2h 1m,12A,5.4 (271K),"Batman must battle former district attorney Harvey Dent, who is now Two-Face and Edward Nygma, The Riddler with help from an amorous psychologist and a young circus acrobat who becomes his sidekick, Robin."
The Patriot,tt0187393,2000,2h 45m,15,7.2 (299K),Peaceful farmer Benjamin Martin is driven to lead the Colonial Militia during the American Revolution when a sadistic British officer murders his son.
The Transporter,tt0293662,2002,1h 32m,15,6.8 (326K),"Frank Martin, who ""transports"" packages for unknown clients, is asked to move a package that soon begins moving, and complications arise."
Bad Boys,tt0112442,1995,1h 59m,18,6.8 (300K),Two hip detectives protect a witness to a murder while investigating a case of stolen heroin from the evidence storage room from their police precinct.
Green Street,tt0385002,2005,1h 49m,18,7.4 (164K),"A wrongfully expelled Harvard undergrad moves to London, where he is introduced to the violent underworld of football hooliganism."
The Mist,tt0884328,2007,2h 6m,15,7.1 (350K),"A thick fog descends upon a rural community, killing anyone caught outside, survivors seek refuge in a local store. Trapped in a darkened cloud of pure horror, the frightened denizens of the town must fend off murderous monster waves."
Friday the 13th,tt0758746,2009,1h 37m,18,5.5 (120K),A group of young adults visit a boarded up campsite named Crystal Lake where they soon encounter the mysterious Jason Voorhees and his deadly intentions.
The Godfather Part III,tt0099674,1990,2h 42m,15,7.6 (432K),"Follows Michael Corleone, now in his 60s, as he seeks to free his family from crime and find a suitable successor to his empire."
Toy Story 2,tt0120363,1999,1h 32m,U,7.9 (633K),"When Woody is stolen by a toy collector, Buzz and his friends set out on a rescue mission to save Woody before he becomes a museum toy property with his roundup gang Jessie, Prospector, and Bullseye."
King Arthur,tt0349683,2004,2h 6m,12A,6.3 (178K),A demystified take on the tale of King Arthur and the Knights of the Round Table.
Insomnia,tt0278504,2002,1h 58m,15,7.2 (325K),"Will Dormer, a police detective, is sent to investigate a teenage girl's murder to a small fishing town where he accidentally shoots his co-detective and is afflicted by insomnia brought by the guilt."
Crank,tt0479884,2006,1h 28m,18,6.9 (268K),Professional assassin Chev Chelios learns his rival has injected him with a poison that will kill him if his heart rate drops.
Gone in Sixty Seconds,tt0187078,2000,1h 58m,15,6.5 (299K),A retired master car thief must come back to the industry and steal fifty cars with his crew in one night to save his brother's life.
50 First Dates,tt0343660,2004,1h 39m,12A,6.8 (390K),Henry Roth is a man afraid of commitment until he meets the beautiful Lucy. They hit it off and Henry think he's finally found the girl of his dreams until discovering she has short-term memory loss and forgets him the next day.
Vanilla Sky,tt0259711,2001,2h 16m,15,6.9 (290K),A self-indulgent and vain publishing magnate finds his privileged life upended after a vehicular accident with a resentful lover.
The Perfect Storm,tt0177971,2000,2h 10m,12,6.5 (181K),An unusually intense storm pattern catches some commercial fishermen unaware and puts them in mortal danger.
Crank 2: High Voltage,tt1121931,2009,1h 36m,18,6.1 (161K),Chelios faces a Chinese mobster who has stolen his nearly indestructible heart and replaced it with a battery-powered ticker which requires regular jolts of electricity to keep working.
Blade,tt0120611,1998,2h,18,7.1 (310K),"A half-vampire, half-mortal man becomes a protector of the mortal race, while slaying evil vampires."
You Don't Mess with the Zohan,tt0960144,2008,1h 53m,12A,5.6 (218K),An Israeli Special Forces Soldier fakes his death so he can re-emerge in New York City as a hair stylist.
30 Days of Night,tt0389722,2007,1h 53m,15,6.6 (193K),"After an Alaskan town is plunged into darkness for a month, it is attacked by a bloodthirsty gang of vampires."
Men in Black,tt0119654,1997,1h 38m,12,7.3 (626K),"James, an NYC cop, is hired by Agent K of a secret government agency that monitors extraterrestrial life on Earth. Together, they must recover an item that has been stolen by an intergalactic villain."
Step Up,tt0462590,2006,1h 44m,PG,6.5 (129K),"Tyler receives the opportunity of a lifetime after vandalizing a performing arts school, gaining him the chance to earn a scholarship and dance with an up and coming dancer, Nora."
The Kingdom,tt0431197,2007,1h 50m,15,7.0 (134K),A team of U.S. government agents are sent to investigate the bombing of an American facility in the Middle East.
Van Wilder: Party Liaison,tt0283111,2002,1h 32m,15,6.4 (117K),The most popular kid on campus meets a beautiful journalist who makes him realize that maybe he's afraid to graduate.
The Box,tt0362478,2009,1h 55m,12A,5.6 (96K),"With the press of a button, a wooden box bestows riches and death."
1408,tt0450385,2007,1h 44m,15,6.8 (300K),"Author Michael Enslin specializes in debunking paranormal occurrences, checks into the fabled room 1408 in the Dolphin Hotel in New York City, settles in, and soon confronts genuine terror."
Transporter 3,tt1129442,2008,1h 44m,15,6.1 (179K),"Frank Martin is forced to deliver Valentina, the kidnapped daughter of a Ukrainian government official, from Marseilles to Odessa on the Black Sea. En route, he has to contend with thugs who want to intercept Valentina's safe delivery."
Total Recall,tt0100802,1990,1h 53m,18,7.5 (361K),"When a man goes in to have virtual vacation memories of the planet Mars implanted in his mind, an unexpected and harrowing series of events forces him to go to the planet for real - or is he?"
Austin Powers: International Man of Mystery,tt0118655,1997,1h 34m,15,7.0 (262K),A world-class playboy and part-time secret agent from the 1960s emerges after thirty years in a cryogenic state to battle with his nemesis Dr. Evil.
Legally Blonde,tt0250494,2001,1h 36m,12,6.5 (257K),"Fashionable sorority queen Elle Woods follows her ex-boyfriend to law school, where she discovers that there is more to her than just looks."
Mission: Impossible III,tt0317919,2006,2h 6m,12A,6.9 (397K),IMF agent Ethan Hunt comes into conflict with a dangerous and sadistic arms dealer who threatens his life and his fiancée in response.
Meet the Fockers,tt0290002,2004,1h 55m,12A,6.3 (291K),All hell breaks loose when the Byrnes family meets the Focker family for the first time.
There's Something About Mary,tt0129387,1998,1h 59m,15,7.1 (334K),"A man gets a chance to meet up with his dream girl from high school, even though his date with her back then was a complete disaster."
Natural Born Killers,tt0110632,1994,1h 59m,18,7.2 (256K),Two victims of traumatized childhoods become lovers and psychopathic serial murderers irresponsibly glorified by the mass media.
Austin Powers in Goldmember,tt0295178,2002,1h 34m,12,6.2 (226K),"Upon learning that his father has been kidnapped, Austin Powers must travel to 1975 and defeat the aptly named villain Goldmember, who is working with Dr. Evil."
Eragon,tt0449010,2006,1h 44m,PG,5.1 (132K),"In his homeland of Alagaesia, a farm boy happens upon a dragon's egg -- a discovery that leads him on a predestined journey where he realizes he's the one person who can defend his home against an evil king."
Apollo 13,tt0112384,1995,2h 20m,PG,7.7 (321K),NASA must devise a strategy to return Apollo 13 to Earth safely after the spacecraft undergoes massive internal damage putting the lives of the three astronauts on board in jeopardy.
Be Cool,tt0377471,2005,1h 58m,12A,5.6 (73K),"Disenchanted with the movie industry, Chili Palmer tries the music industry, meeting and romancing a widow of a music executive on the way."
Grease 2,tt0084021,1982,1h 55m,PG,4.6 (39K),A British student at a 1960s American high school must prove himself to the leader of a girls' gang whose members can only date greasers.
Dodgeball: A True Underdog Story,tt0364725,2004,1h 32m,12A,6.7 (272K),A group of misfits enter a Las Vegas dodgeball tournament in order to save their cherished local gym from the onslaught of a corporate health fitness chain.
Dogma,tt0120655,1999,2h 10m,15,7.3 (232K),An abortion clinic worker with a special heritage is called upon to save the existence of humanity from being negated by two renegade angels trying to exploit a loop-hole and reenter Heaven.
Signs,tt0286106,2002,1h 46m,12A,6.8 (395K),"A widowed former reverend living with his children and brother on a Pennsylvania farm finds mysterious crop circles in their fields, which suggests something more frightening to come."
The Punisher,tt0330793,2004,2h 4m,18,6.4 (173K),An undercover FBI agent becomes a vigilante and sets out to unleash his wrath upon the corrupt businessman who slaughtered his entire family at a reunion.
Road Trip,tt0215129,2000,1h 33m,15,6.5 (181K),Four college buddies embark on a road trip to retrieve an illicit tape mistakenly mailed to a female friend.
Bad Boys II,tt0172156,2003,2h 27m,15,6.6 (277K),Two loose-cannon narcotics cops investigate the flow of Ecstasy into Florida from a Cuban drug cartel.
The Prince & Me,tt0337697,2004,1h 51m,PG,5.9 (42K),"At college Paige meets Eddie, a student from Denmark, whom she first dislikes but later accepts, likes, and loves; he proves to be Crown Prince Edvard. Paige follows him to Copenhagen, and he follows her back to school with a plan."
The Royal Tenenbaums,tt0265666,2001,1h 50m,15,7.6 (317K),The eccentric members of a dysfunctional family reluctantly gather under the same roof for various reasons.
Evan Almighty,tt0413099,2007,1h 36m,PG,5.4 (157K),God contacts Congressman Evan Baxter and tells him to build an ark in preparation for a great flood.
The Others,tt0230600,2001,1h 41m,12A,7.6 (402K),"In 1945, immediately following the end of Second World War, a woman who lives with her two photosensitive children on her darkened old family estate in the Channel Islands becomes convinced that the home is haunted."
The Golden Compass,tt0385752,2007,1h 53m,PG,6.1 (199K),"In a parallel universe, young Lyra Belacqua journeys to the far North to save her best friend and other kidnapped children from terrible experiments by a mysterious organization."
The Untouchables,tt0094226,1987,1h 59m,15,7.8 (337K),"During Prohibition, Treasury agent Eliot Ness sets out to stop ruthless Chicago gangster Al Capone, and assembles a small, incorruptible team to help him."
The Longest Yard,tt0398165,2005,1h 53m,12A,6.4 (200K),Prison inmates form a football team to challenge the prison guards.
Chocolat,tt0241303,2000,2h 1m,12,7.2 (205K),"Single mother Vianne Rocher and her young daughter arrive in a rural French town in the winter of 1959, and open an unusual chocolate shop that disrupts the moral fiber of the strictly Catholic townsfolk and mayor."
Donnie Brasco,tt0119008,1997,2h 7m,18,7.7 (339K),An FBI undercover agent infiltrates the mob and finds himself identifying more with the Mafia life--at the expense of his regular one.
Notting Hill,tt0125439,1999,2h 4m,15,7.2 (353K),"A set of circumstances makes Anna Scott, a famous actress, fall in love with William Thacker, owner of a bookstore in Notting Hill. But the paparazzi's fascination with her complicates their bond."
"10,000 BC",tt0443649,2008,1h 49m,12A,5.1 (137K),"In the prehistoric past, D'Leh is a mammoth hunter who bonds with the beautiful Evolet. When warriors on horseback capture Evolet and the tribesmen, D'Leh must embark on an odyssey to save his true love."
Shrek the Third,tt0413267,2007,1h 33m,U,6.1 (340K),"Reluctantly designated as the heir to the land of Far, Far Away, Shrek hatches a plan to install the rebellious Artie as the new king while Princess Fiona tries to fend off a coup d'état by the jilted Prince Charming."
Finding Neverland,tt0308644,2004,1h 46m,PG,7.7 (213K),The story of Sir J.M. Barrie's friendship with a family who inspired him to create Peter Pan.
The Orphanage,tt0464141,2007,1h 45m,15,7.4 (166K),"A woman brings her family back to her childhood home, which used to be an orphanage for handicapped children. Before long, her son starts to communicate with an invisible new friend."
Big Daddy,tt0142342,1999,1h 33m,12,6.4 (239K),"A lazy law school graduate adopts a kid to impress his girlfriend, but everything doesn't go as planned."
A Series of Unfortunate Events,tt0339291,2004,1h 48m,PG,6.8 (224K),"When a massive fire kills their parents, three children are delivered to the custody of cousin and stage actor Count Olaf, who is secretly plotting to steal their parents' vast fortune."
The Strangers,tt0482606,2008,1h 26m,15,6.1 (149K),"James Hoyt and Kristen McKay visit an isolated vacation home to enjoy some time together. However, they are in for a rude surprise when three masked assailants make their stay a nightmare."
Alien Resurrection,tt0118583,1997,1h 49m,18,6.2 (276K),"Two centuries after her death, a powerful human/alien hybrid clone of Ellen Ripley aids a crew of space pirates in stopping the aliens from reaching Earth."
The Hitchhiker's Guide to the Galaxy,tt0371724,2005,1h 49m,PG,6.7 (211K),"Mere seconds before the Earth is to be demolished by an alien construction crew, journeyman Arthur Dent is swept off the planet by his friend Ford Prefect, a researcher penning a new edition of ""The Hitchhiker's Guide to the Galaxy."""
The Final Destination,tt1144884,2009,1h 22m,15,5.1 (119K),A horrifying premonition saves a young man and his friends from death during a racetrack accident but terrible fates await them nonetheless.
Jackie Brown,tt0119396,1997,2h 34m,15,7.5 (383K),"A flight attendant with a criminal past gets nabbed by the ATF for smuggling. Under pressure to become an informant against the illegal arms dealer she works for, she must find a way to secure her future without getting killed."
Anger Management,tt0305224,2003,1h 46m,15,6.3 (232K),"Dave Buznik is a businessman who is wrongly sentenced to an anger management program, where he meets an aggressive instructor."
A Man Apart,tt0266465,2003,1h 49m,18,6.0 (50K),A man known as Diablo emerges to head a drug cartel after the previous leader is imprisoned.
