Name,ID,Year,Length,Age,Rating,Description
The Frozen Ground,tt2005374,2013,1h 45m,15,6.4 (69K),An Alaska State Trooper partners with a young woman who escaped the clutches of serial killer Robert Hansen to bring the murderer to justice. Based on actual events.
The Losers,tt0480255,2010,1h 37m,12A,6.2 (108K),"A CIA special forces team is betrayed and left for dead by their superiors, galvanizing them to mount an offensive on the CIA."
About Alex,tt2667918,2014,1h 39m,R,6.3 (7.9K),"When a group of old college friends reunites over a long weekend after one of them attempts suicide, old crushes and resentments shine light on their life decisions--and ultimately push friendships and relationships to the brink."
Along Came a Spider,tt0164334,2001,1h 44m,15,6.4 (98K),"When a senator's daughter under Secret Service protection is kidnapped from a private school, detective Alex Cross investigates the case even though he's recovering from the loss of his partner."
Endless Love,tt2318092,2014,1h 44m,12A,6.2 (48K),The story of a privileged girl and a charismatic boy whose instant desire sparks a love affair made only more reckless by parents trying to keep them apart.
War Room,tt3832914,2015,2h,PG,6.5 (17K),"A seemingly perfect family looks to fix their problems with the help of Miss Clara, an older, wiser woman."
Fast Girls,tt1700808,2012,1h 31m,12A,6.2 (3.9K),A street smart runner develops an intense rivalry with an equally ambitious wealthy young athlete.
Center Stage: Turn It Up,tt1145144,2008,1h 35m,PG-13,6.0 (6.4K),A self-trained dancer from the streets of Detroit finds her way after auditioning for the most prestigious ballet academy in New York.
Solaris,tt0307479,2002,1h 39m,12A,6.2 (87K),A troubled psychologist is sent to investigate the crew of an isolated research station orbiting a bizarre planet.
A New York Winter's Tale,tt1837709,2014,1h 58m,12A,6.1 (58K),"A burglar falls for an heiress as she dies in his arms. When he learns that he has the gift of reincarnation, he sets out to save her."
The Karate Kid,tt1155076,2010,2h 20m,PG,6.2 (212K),"Work causes a single mother to move to China with her young son; in his new home, the 12-year-old boy embraces Kung Fu, taught to him by a master."
Adore,tt2103267,2013,1h 52m,15,6.2 (37K),A pair of childhood friends and neighbors fall for each other's sons.
Come Undone,tt1403144,2010,2h 6m,Unrated,6.0 (3.4K),"One day at a colleague's going away party, Anna meets Domenico, a virile, slightly older chap who's married with two small kids. Passion's flames are rapidly kindled and result in steamy encounters."
"Crouching Tiger, Hidden Dragon: Sword of Destiny",tt2652118,2016,1h 36m,12,6.1 (21K),"A story of lost love, young love, a legendary sword and one last opportunity at redemption."
Save the Last Dance,tt0206275,2001,1h 52m,12,6.2 (67K),"A white midwestern girl moves to Chicago, where her new boyfriend is a black teen from the South Side with a rough, semi-criminal past."
Hateship Loveship,tt2463512,2013,1h 44m,R,6.1 (7.3K),"A wild teenage girl orchestrates a romance between her nanny and her father, who is a recovering addict."
The Bodyguard,tt0103855,1992,2h 9m,15,6.4 (151K),"A former Secret Service agent takes on the job of bodyguard to an R&B singer, whose lifestyle is most unlike a President's."
We Are Your Friends,tt3787590,2015,1h 36m,15,6.2 (41K),"Caught between a forbidden romance and the expectations of his friends, aspiring DJ Cole Carter attempts to find the path in life that leads to fame and fortune."
Echo Park,tt3250650,2014,1h 28m,N/A,6.0 (520),"Two people struggling to find their way in and out of unhappy relationships and unhappy lives, whilst a foreigner to the love equation struggles to comprehend their love-fueled decisions."
San Andreas,tt2126355,2015,1h 54m,12A,6.1 (263K),"In the aftermath of a massive earthquake in California, a rescue-chopper pilot makes a dangerous journey with his ex-wife across the state in order to rescue his daughter."
Ask Me Anything,tt2505294,2014,1h 40m,15,6.0 (13K),"A confused teenager writes a blog revealing her daily activities and secrets, advised to do so by her high school guidance counselor in lieu of moving on to her first year in college."
Here,tt1127886,2011,2h 6m,Not Rated,5.8 (979),"Cartographer Will Shepard hits the road for his latest job: to create a new, more accurate satellite survey of Armenia. During his assignment, he forms a bond with an Armenian expatriate and art photographer."
Disclosure,tt0109635,1994,2h 8m,18,6.2 (55K),"A computer specialist is sued for sexual harassment by a former lover turned boss who initiated the act forcefully, which threatens both his career and his personal life."
Love,tt3774694,2015,2h 15m,18,6.1 (69K),"Murphy is an American living in Paris who enters a highly sexually and emotionally charged relationship with Electra. Unaware of the effect it will have on their relationship, they invite their pretty neighbor into their bed."
Nights in Rodanthe,tt0956038,2008,1h 37m,PG,6.0 (27K),"A doctor, who is travelling to see his estranged son, sparks with an unhappily married woman at a North Carolina inn."
StreetDance 3D,tt1447972,2010,1h 38m,PG,5.8 (12K),"In order to win the Street Dance Championships, a dance crew is forced to work with ballet dancers from the Royal Dance School in exchange for rehearsal space."
Hope Floats,tt0119313,1998,1h 54m,PG,6.0 (31K),"Birdee Calvert must choose between her morals and her heart after her husband divorces her and a charming young man, who her daughter disapproves of, comes back into her life."
Heart of the Country,tt2231251,2013,1h 29m,PG,5.7 (1.6K),"The story of a girl who abandoned her family for the big city, returns home to the heart of the country. She finds values and love there that her life was missing. You can always go home."
The River Why,tt1241329,2010,1h 41m,PG-13,5.5 (4K),A young man abandons his family for a solitary life of fly-fishing. His goal was to find his own way in the fishing world and thereby find himself and love.
G.I. Jane,tt0119173,1997,2h 5m,15,6.0 (89K),"Lt. Jordan, a US Navy topographic analyst, joins the US Navy Special Warfare Group and struggles to prove her worth in a unit dominated by men. But a cynical woman Texan senator has sold her out."
Love Me Like You Do,tt3270108,2014,1h 30m,12,5.9 (4.8K),"A modern day train hopper fighting to become a successful musician, and a single mom battling to maintain custody of her daughter, defy their circumstances by coming together in a relationship that may change each others lives forever."
28 Hotel Rooms,tt2124074,2012,1h 22m,Not Rated,5.7 (3.7K),"A novelist and an accountant meet while they are traveling for work, and though they both are in relationships, their one-night stand could become something more."
Soda Springs,tt1533087,2012,1h 55m,TV-PG,6.2 (478),The story of a man's struggle to claim his future by confronting his past. The road is not an easy one as old demons resurface to threaten everything Eden has fought to overcome.
The Babysitters,tt0796302,2007,1h 28m,18,5.6 (13K),"After fooling around with one of her customers, a teenager turns her babysitting service into a call-girl service for married guys."
Reckless,tt3346224,2015,1h 52m,15,5.8 (8.2K),A successful family man with a blossoming political career loses all sense of morality when he becomes addicted to using an escort agency.
Bounce,tt0186894,2000,1h 46m,12,5.8 (22K),A man switches plane tickets with another man who dies in that plane in a crash. The man falls in love with the deceased one's wife.
The Lifeguard,tt2265534,2013,1h 38m,15,5.6 (15K),A former valedictorian quits her reporter job in New York and returns to the place she last felt happy: her childhood home in Connecticut. She gets work as a lifeguard and starts a dangerous relationship with a troubled teenager.
Summer in February,tt2184287,2013,1h 40m,15,5.6 (4.4K),"A true tale of love, liberty and scandal amongst the Edwardian artists' colony in Cornwall in 1914."
Angel Eyes,tt0225071,2001,1h 42m,15,5.7 (26K),"A mysterious man is drawn to a feisty female police officer and an unusual relationship ensues, as not everything is as it seems."
Tracers,tt2401097,2015,1h 34m,12,5.6 (20K),"Wanted by the Chinese mafia, a New York City bike messenger escapes into the world of parkour after meeting a beautiful stranger."
Fighting,tt1082601,2009,1h 45m,15,5.6 (35K),"In New York City, a young counterfeiter is introduced to the world of underground street fighting by a seasoned scam artist, who becomes his manager on the bare-knuckling brawling circuit."
The Twilight Saga: Breaking Dawn - Part 2,tt1673434,2012,1h 55m,12A,5.6 (268K),"After the birth of Renesmee/Nessie, the Cullens gather other vampire clans in order to protect the child from a false allegation that puts the family in front of the Volturi."
Daddy's Little Girls,tt0778661,2007,1h 40m,15,5.9 (8.5K),A mechanic and his family are struggling to make ends meet with his ex-girlfriend and her drug dealing boyfriend He struggles to get custody of his children during the way he falls inlove with his attorney.
Stomp the Yard,tt0775539,2007,1h 55m,12A,5.4 (27K),"When his brother is murdered, a street dancer moves to Georgia to work his way through college. He joins a fraternity's step dancing team for a competition. Will he also get an education and the girl?"
The Twilight Saga: Eclipse,tt1325004,2010,2h 4m,12A,5.1 (266K),"As a string of mysterious killings grips Seattle, Bella, whose high school graduation is fast approaching, is forced to choose between her love for vampire Edward and her friendship with werewolf Jacob."
God's Not Dead,tt2528814,2014,1h 53m,PG,4.6 (46K),"College philosophy professor Mr. Radisson's curriculum is challenged by his new student, Josh, who believes God exists."
The Twilight Saga: Breaking Dawn - Part 1,tt1324999,2011,1h 57m,12A,4.9 (259K),"The Quileutes close in on expecting parents Edward and Bella, whose unborn child poses a threat to the Wolf Pack and the towns people of Forks."
The Twilight Saga: New Moon,tt1259571,2009,2h 10m,12A,4.8 (306K),"After Edward leaves because of an incident involving Bella, Jacob Black becomes her best friend. But what Bella doesn't realize is that Jacob also has a secret that will change their lives suddenly."
Breaking Through,tt3676370,2015,1h 41m,12A,4.4 (438),"When Casey, a dancer who is discovered on YouTube, gets thrust into the modern world of internet celebrity and culture, she must find a way to balance her true identity with her online persona, or risk losing everything she cares about."
Fifty Shades of Grey,tt2322441,2015,2h 5m,18,4.2 (342K),"Literature student Anastasia Steele's life changes forever when she meets handsome, yet tormented, billionaire Christian Grey."
London Has Fallen,tt3300542,2016,1h 39m,15,5.9 (173K),"In London for the Prime Minister's funeral, Mike Banning is caught up in a plot to assassinate all the attending world leaders."
XOXO,tt4855748,2016,1h 32m,15,5.3 (7.3K),"Six strangers' lives collide in one frenetic, dream-chasing, hopelessly romantic night."
Sky,tt4106306,2015,1h 40m,15,5.8 (2.5K),"Romy (Diane Kruger) is on holiday in the USA with her French husband, Richard (Gilles Lellouche). But the journey quickly turns into a settling of old scores for this worn out couple. After an ultimate fight, Romy decides to break free. She cuts off her ties to a stable and secure life that has become alienating and escapes to the unknown."
Lion,tt3741834,2016,1h 58m,PG,8.0 (256K),"A five-year-old Indian boy is adopted by an Australian couple after getting lost hundreds of kilometers from home. 25 years later, he sets out to find his lost family."
The Accountant,tt2140479,2016,2h 8m,15,7.3 (332K),"As a math savant uncooks the books for a new client, the Treasury Department closes in on his activities, and the body count starts to rise."
Hacksaw Ridge,tt2119532,2016,2h 19m,15,8.1 (618K),"World War II American Army Medic Desmond T. Doss, serving during the Battle of Okinawa, refuses to kill people and becomes the first man in American history to receive the Medal of Honor without firing a shot."
Passengers,tt1355644,2016,1h 56m,12A,7.0 (464K),A malfunction in a sleeping pod on a spacecraft traveling to a distant colony planet wakes one passenger 90 years early.
Mr. Church,tt4196848,2016,1h 44m,12,7.6 (32K),Unique friendship develops when a girl and her dying mother retain the services of a talented cook - Henry Joseph Church. What begins as a six month arrangement instead spans into fifteen years and creates a family bond that lasts forever.
Pelé: Birth of a Legend,tt0995868,2016,1h 47m,PG,7.1 (22K),Pele's meteoric rise from the slums of Sao Paulo to leading Brazil to its first World Cup victory at the age of 17 is chronicled in this biographical drama.
Aftershock,tt1393746,2010,2h 15m,15,7.5 (9.9K),The epic story of a family separated as a result of the Great Tangshan Earthquake of 1976.
"Like Father, Like Son",tt2331143,2013,2h 1m,PG,7.8 (29K),"Ryota is a successful workaholic businessman. When he learns that his biological son was switched with another boy after birth, he faces the difficult decision to choose his true son or the boy he and his wife have raised as their own."
Me Before You,tt2674426,2016,1h 50m,12A,7.4 (300K),A girl in a small town forms an unlikely bond with a recently-paralyzed man she's taking care of.
Collateral Beauty,tt4682786,2016,1h 37m,PG-13,6.8 (106K),"Retreating from life after a tragedy, a man questions the universe by writing to Love, Time, and Death. Receiving unexpected answers, he begins to see how these things interlock and how even loss can reveal moments of meaning and beauty."
Loving,tt4669986,2016,2h 3m,12A,7.0 (37K),"The story of Richard and Mildred Loving, a couple whose arrest for interracial marriage in 1960s Virginia began a legal battle that would end with the Supreme Court's historic 1967 decision."
People Like Us,tt1716777,2012,1h 54m,12A,7.0 (44K),"While settling his recently deceased father's estate, a salesman discovers he has a sister whom he never knew about, leading both siblings to re-examine their perceptions about family and life choices."
The Song,tt2517044,2014,1h 56m,12,5.9 (2.3K),An aspiring singer-songwriter's life and marriage suffer when the song he writes for his wife propels him to stardom.
A Man Called Ove,tt4080728,2015,1h 56m,15,7.7 (70K),"Ove, an ill-tempered, isolated retiree who spends his days enforcing block association rules and visiting his wife's grave, has finally given up on life just as an unlikely friendship develops with his boisterous new neighbors."
Wind River,tt5362988,2017,1h 47m,15,7.7 (289K),"A wildlife officer, who is haunted by a tragedy that happened because of him, teams up with an FBI agent in solving a murder of a young woman on a Wyoming Native American reservation and hopes to get redemption from his past regrets."
A Little Chaos,tt2639254,2014,1h 57m,12A,6.5 (26K),"Famed builder Le Notre is tasked with building an ethereal palace for King Louis XIV that transcends beauty. Le Notre hires Sabine de Barra to design and construct the outdoor ballroom, and is soon captivated by her beauty."
Kill the Messenger,tt1216491,2014,1h 52m,15,6.9 (49K),"Journalist Gary Webb, California 1996, started investigating CIA's role in the 1980s in getting crack cocaine to the black part of LA to get money and weapons to the Contra insurgents in Nicaragua."
Patriots Day,tt4572514,2016,2h 13m,15,7.3 (116K),"The story of the 2013 Boston Marathon bombing and the aftermath, which includes the city-wide manhunt to find the terrorists responsible."
The Light Between Oceans,tt2547584,2016,2h 13m,12A,7.2 (61K),A lighthouse keeper and his wife living off the coast of Western Australia raise a baby they rescue from a drifting rowing boat.
Sully,tt3263904,2016,1h 36m,12A,7.4 (305K),"When pilot Chesley ""Sully"" Sullenberger lands his damaged plane on the Hudson River in order to save the flight's passengers and crew, some consider him a hero while others think he was reckless."
A Perfect World,tt0107808,1993,2h 18m,15,7.5 (89K),"A kidnapped boy strikes up a friendship with his captor, an escaped convict on the run from the law, while the search for him continues."
Wonder,tt2543472,2017,1h 53m,PG,7.9 (185K),"Based on the New York Times bestseller, this movie tells the incredibly inspiring and heartwarming story of August Pullman, a boy with facial differences who enters the fifth grade, attending a mainstream elementary school for the first time."
Mustang,tt3966404,2015,1h 37m,15,7.6 (42K),"When five orphan girls are seen innocently playing with boys on a beach, their scandalized conservative guardians confine them while forced marriages are arranged."
Miss Sloane,tt4540710,2016,2h 12m,15,7.5 (85K),"In the high-stakes world of political power-brokers, Elizabeth Sloane is the most sought after and formidable lobbyist in D.C. But when taking on the most powerful opponent of her career, she finds winning may come at too high a price."
Rise of the Planet of the Apes,tt1318514,2011,1h 45m,12A,7.6 (586K),A substance designed to help the brain repair itself gives advanced intelligence to a chimpanzee who leads an ape uprising.
The Hunt,tt2106476,2012,1h 55m,15,8.3 (376K),"A teacher lives a lonely life, all the while struggling over his son's custody. His life slowly gets better as he finds love and receives good news from his son, but his new luck is about to be brutally shattered by an innocent little lie."
The Greatest Showman,tt1485796,2017,1h 45m,PG,7.5 (322K),Celebrates the birth of show business and tells of a visionary who rose from nothing to create a spectacle that became a worldwide sensation.
Gifted,tt4481414,2017,1h 41m,12A,7.6 (143K),"Frank, a single man raising his child prodigy niece Mary, is drawn into a custody battle with his mother."
Only the Brave,tt3829920,2017,2h 14m,12A,7.6 (80K),"Based on the true story of the Granite Mountain Hotshots, a group of elite firefighters who risk everything to protect a town from a historic wildfire."
I Can Only Imagine,tt6450186,2018,1h 50m,PG,7.3 (19K),"The inspiring and unknown true story behind MercyMe's beloved, chart topping song that brings ultimate hope to so many is a gripping reminder of the power of true forgiveness."
My All-American,tt3719896,2015,1h 58m,PG,7.2 (8.4K),"Freddie Steinmark, an underdog on the gridiron, faces the toughest challenge of his life after leading his team to a championship season."
Shot Caller,tt4633690,2017,2h 1m,15,7.3 (104K),A newly released prisoner is forced by the leaders of his gang to orchestrate a major crime with a brutal rival gang on the streets of Southern California.
Molly's Game,tt4209788,2017,2h 20m,15,7.4 (193K),"The true story of Molly Bloom, an Olympic-class skier who ran the world's most exclusive high-stakes poker game and became an FBI target."
The Mountain Between Us,tt2226597,2017,1h 52m,12A,6.4 (82K),"Stranded after a tragic plane crash, two strangers must forge a connection to survive the extreme elements of a remote snow-covered mountain. When they realize help is not coming, they embark on a perilous journey across the wilderness."
Creed II,tt6343314,2018,2h 10m,12A,7.1 (160K),"Under the tutelage of Rocky Balboa, newly crowned heavyweight champion Adonis Creed faces off against Viktor Drago, the son of Ivan Drago."
The Guernsey Literary and Potato Peel Pie Society,tt1289403,2018,2h 4m,12A,7.3 (54K),"In the aftermath of World War II, a writer forms an unexpected bond with the residents of Guernsey Island when she decides to write a book about their experiences during the war. Then she learns the secret they are afraid to reveal."
The Hate U Give,tt5580266,2018,2h 13m,12A,7.5 (41K),"Starr witnesses the fatal shooting of her childhood best friend Khalil at the hands of a police officer. Now, facing pressure from all sides of the community, Starr must find her voice and stand up for what's right."
Breakthrough,tt7083526,2019,1h 56m,12A,6.3 (11K),"When her 14-year-old son drowns in a lake, a faithful mother prays for him to come back from the brink of death and be healed."
A Star Is Born,tt1517451,2018,2h 16m,15,7.6 (429K),A musician helps a young singer find fame as age and alcoholism send his own career into a downward spiral.
Sicario 2: Soldado,tt5052474,2018,2h 2m,15,7.1 (173K),"The drug war on the U.S.-Mexico border has escalated as the cartels have begun trafficking terrorists across the US border. To fight the war, federal agent Matt Graver re-teams with the mercurial Alejandro."
Maudie,tt3721954,2016,1h 55m,12A,7.6 (23K),An arthritic Nova Scotia woman works as a housekeeper while she hones her skills as an artist and eventually becomes a beloved figure in the community.
Avengers: Endgame,tt4154796,2019,3h 1m,12A,8.4 (1.3M),"After the devastating events of Avengers: Infinity War (2018), the universe is in ruins. With the help of remaining allies, the Avengers assemble once more in order to reverse Thanos' actions and restore balance to the universe."
Overcomer,tt8186318,2019,1h 59m,PG,6.7 (5.9K),"A high-school basketball coach is asked to take over the cross-country program, where he encounters a troubled teen."
The Girl with the Dragon Tattoo,tt1568346,2011,2h 38m,18,7.8 (506K),Journalist Mikael Blomkvist is aided in his search for a woman who has been missing for 40 years by hacker Lisbeth Salander.
A Distant Thunder,tt0075945,1978,1h 16m,TV-PG,5.1 (475),"This second film of four, ""A Distant Thunder"", continues the story of Patty, a young woman living in the ""end times"" of biblical prophecy, begun in the first film of the series, entitled ""A Thief in the Night"".This second film finds Patty living as a fugitive, trying to hide from the ever-increasing evil around her. Relentlessly pursued and finally captured by the forces of UNITE, she is given a choice: Either receive ""the mark"" or face death."
Pretty Baby,tt0078111,1978,1h 50m,X,6.5 (13K),A preteen girl lives as a prostitute in New Orleans in 1917.
Red Sparrow,tt2873282,2018,2h 20m,15,6.6 (206K),Prima ballerina Dominika Egorova turns dangerous Sparrow.
A Thief in the Night,tt0070795,1972,1h 9m,TV-PG,4.6 (1K),"The story of Patty, a young woman living for the present with little concern for the future. She meets and marries a young man and her life seems great, until one morning she awakens to find her husband gone and the radio reporting that millions of people have mysteriously disappeared. As dramatic, earth-shaking events unfold around her, Patty realizes that she is living in the end times spoken of in biblical prophecy. Adventure and suspense build to a though-provoking climax in this powerfully gripping film."
1917,tt8579674,2019,1h 59m,15,8.2 (705K),"April 6th, 1917. As an infantry battalion assembles to wage war deep in enemy territory, two soldiers are assigned to race against time and deliver a message that will stop 1,600 men from walking straight into a deadly trap."
Finding the Way Back,tt8544498,2020,1h 48m,15,6.7 (54K),"Jack Cunningham was a high school basketball phenom who walked away from the game, forfeiting his future. Years later, when he reluctantly accepts a coaching job at his alma mater, he may get one last shot at redemption."
Words on Bathroom Walls,tt8045906,2020,1h 50m,12A,7.2 (14K),"Diagnosed with a mental illness halfway through his senior year of high school, a witty, introspective teen struggles to keep it a secret while falling in love with a brilliant classmate who inspires him to not be defined by his condition."
In the Heights,tt1321510,2021,2h 23m,PG,7.3 (53K),"In Washington Heights, a sympathetic New York bodega owner saves every penny every day as he imagines and sings about a better life."
Le Mans '66,tt1950186,2019,2h 32m,12A,8.1 (503K),American car designer Carroll Shelby and driver Ken Miles battle corporate interference and the laws of physics to build a revolutionary race car for Ford in order to defeat Ferrari at the 24 Hours of Le Mans in 1966.
Persuasion,tt0844330,2007,1h 33m,PG,7.4 (17K),"Anne was in love with Frederick, who was rejected by her snobby parents 8 years ago. They've now hit hard times and rent out their mansion to his brother-in-law. He returns a Royal Navy captain. Will he remember Anne?"
Love Jones,tt0119572,1997,1h 49m,15,7.3 (5.8K),"Darius Lovehall is a young black poet in Chicago who starts dating Nina Mosley, a beautiful and talented photographer. While trying to figure out if they've got a ""love thing"" or are just ""kicking it,"" they hang out with their friend, talking about love and sex. Then Nina tests the strength of Darius' feelings and sets a chain of romantic complications into motion."
Dune: Part One,tt1160419,2021,2h 35m,12A,8.0 (917K),"Paul Atreides arrives on Arrakis after his father accepts the stewardship of the dangerous planet. However, chaos ensues after a betrayal as forces clash to control melange, a precious resource."
Dune: Part Two,tt15239678,2024,2h 46m,12A,8.5 (551K),"Paul Atreides unites with the Fremen while on a warpath of revenge against the conspirators who destroyed his family. Facing a choice between the love of his life and the fate of the universe, he endeavors to prevent a terrible future."
Spirited Away,tt0245429,2001,2h 4m,PG,8.6 (882K),"During her family's move to the suburbs, a sullen 10-year-old girl wanders into a world ruled by gods, witches and spirits, and where humans are changed into beasts."
Grave of the Fireflies,tt0095327,1988,1h 28m,12A,8.5 (330K),A young boy and his little sister struggle to survive in Japan during World War II.
Your Name.,tt5311514,2016,1h 46m,12A,8.4 (340K),"Two teenagers share a profound, magical connection upon discovering they are swapping bodies. Things manage to become even more complicated when the boy and girl decide to meet in person."
