Name,ID,Year,Length,Age,Rating,Description
The Nice Guys,tt3799694,2016,1h 56m,15,7.4 (385K),"In 1970s Los Angeles, a mismatched pair of private eyes investigate a missing girl and the mysterious death of a porn star."
The Stunt Man,tt0081568,1980,2h 11m,X,7.0 (11K),"A fugitive stumbles onto a movie set just when they need a new stunt man, takes the job as a way to hide out and falls for the leading lady while facing off with his manipulative director."
The Magnificent Seven,tt2404435,2016,2h 12m,12A,6.9 (233K),Seven gunmen from a variety of backgrounds are brought together by a vengeful young widow to protect her town from the private army of a destructive industrialist.
Black,tt4008758,2015,1h 35m,18,7.0 (4.7K),"When Mavela, member of the notorious youth gang Black Bronx, falls madly in love with a boy from a rival gang, she is forced to make a choice between loyalty and love. A choice that will have dramatic consequences."
Electra Woman and Dyna Girl,tt0283727,2001,15m,Not Rated,6.7 (137),A cheerful young fan attempts to lure a washed-up superheroine out of retirement.
Project A Part II,tt0092501,1987,1h 46m,15,7.0 (12K),"Dragon is now transferred to be the police head of Sai Wan district, and has to contend with a gangster kingpin, anti-Manchu revolutionaries, some runaway pirates, Manchu Loyalists and a corrupt Police Superintendent."
Project A,tt0085127,1983,1h 45m,PG,7.2 (19K),"Fighting against pirates at the turn of the 20th century, the Hong Kong navy are failing miserably. It's up to Sergeant Lung (Jackie Chan) to take matters into his own hands."
The Warriors,tt0080120,1979,1h 33m,X,7.5 (114K),A street gang known as the Warriors must fight its way from the Bronx to its home turf on Coney Island when its members are falsely accused of assassinating a respected gang leader.
Iron Monkey,tt0108148,1993,1h 30m,12,7.5 (17K),A martial artist/doctor steals from the corrupt authorities as a masked thief to give to the poor while another martial artist/doctor is forced to hunt him down. But a major threat unites them as a powerful and traitorous shaolin monk takes over the authorities.
The Street Fighter,tt0073756,1974,1h 31m,X,6.9 (5.8K),"After failing to reach a deal with her enemies, a mercenary karateka protects the daughter of a recently-deceased oil tycoon from the evil conglomerate gunning for her inheritance."
Shaolin Challenges Ninja,tt0080172,1978,1h 45m,R,7.5 (2.8K),A Chinese man (Liu) marries a Japanese woman through an arranged marriage and manages to insult all of her Japanese martial arts family by issuing a challenge to her that is misinterpreted by the others. He must then prove how good Chinese Kung Fu really is through a series of duels with the seven Japanese martial artists who come to meet the challenge.
The Five Venoms,tt0077559,1978,1h 41m,15,7.0 (8.2K),The sixth and final pupil of a dying martial arts teacher is instructed to find the teacher's five former pupils and defeat any evil ones that are among them.
Shaolin and Wu Tang,tt0083062,1983,1h 27m,Unrated,7.1 (1K),Two friends from rival schools are turned against one another by a jealous chief who wants to eliminate those whose fighting styles may rival his own.
Black Rain,tt0096933,1989,2h 5m,18,6.6 (61K),Two NYC cops arrest a Yakuza member and must escort him when he's extradited to Japan.
Drug War,tt2165735,2012,1h 47m,15,7.0 (11K),A drug cartel boss who is arrested in a raid is coerced into betraying his former accomplices as part of an undercover operation.
Point Break,tt0102685,1991,2h 2m,15,7.3 (209K),An F.B.I. Agent goes undercover to catch a gang of surfers who may be bank robbers.
Return to the 36th Chamber,tt0081494,1980,1h 39m,PG,6.9 (4.3K),"When thugs prey upon innocent factory workers, a small-time scammer trains for revenge by studying the moves of Shaolin temple monks."
Hard Boiled,tt0104684,1992,2h 8m,18,7.7 (55K),A tough-as-nails cop teams up with an undercover agent to shut down a sinister mobster and his crew.
Fast & Furious 7,tt2820852,2015,2h 17m,12A,7.1 (421K),Deckard Shaw seeks revenge against Dominic Toretto and his family for his comatose brother.
Fast & Furious 6,tt1905041,2013,2h 10m,12A,7.0 (423K),"Hobbs has Dominic and Brian reassemble their crew to take down a team of mercenaries, but Dominic unexpectedly gets sidetracked with facing his presumed deceased girlfriend, Letty."
Year of the Dragon,tt0090350,1985,2h 14m,18,6.8 (18K),A police detective cracks down on organized crime in Chinatown after the murders of Triad and Mafia leaders.
Outland,tt0082869,1981,1h 49m,AA,6.6 (33K),A federal marshal stationed at a mining colony on the Jupiter moon of Io uncovers a drug-smuggling conspiracy. He gets no help from the workers or authorities when he finds himself marked for murder.
Legend of the Fist: The Return of Chen Zhen,tt1456661,2010,1h 46m,18,6.2 (11K),"The year is 1917 and Chen Zhen, believed to be dead, returns to Shanghai under a false name. He joins a mob boss for info on the Japanese incl. a long kill list and at night fights the Japanese masked."
Snake and Crane Arts of Shaolin,tt0078251,1978,1h 36m,15,6.4 (2.9K),"A martial arts book, which Hsu Yin-Fung carries, is being highly sought by various clans and gangs, but he is in pursuit of someone himself."
The A-Team,tt0429493,2010,1h 57m,12A,6.7 (271K),"A group of Iraq War veterans look to clear their name with the U.S. Military, who suspect the four men of committing a crime for which they were framed."
Snake in the Eagle's Shadow,tt0078252,1978,1h 32m,X,7.3 (13K),"An orphan who has been raised at a kung fu school, where he is treated as little more than a dogsbody and practice target for the students, has a life-changing experience after helping an old peripatetic beggar."
Way of the Dragon,tt0068935,1972,1h 39m,15,7.2 (42K),"A country bumpkin martial artist visits his relatives in Rome, Italy, where he must defend them and their restaurant against harassment from brutal gangsters."
Tokyo Fist,tt0114690,1995,1h 27m,18,7.0 (4.2K),"Suspecting that his childhood friend, a professional boxer, is having a love affair with his fiancée, a businessman starts training rigorously in order to take him down."
Hobo with a Shotgun,tt1640459,2011,1h 26m,18,6.1 (49K),"A homeless vigilante blows away crooked cops, pedophile Santas, and other scumbags with his trusty pump-action shotgun."
Fearless,tt0446059,2006,1h 44m,15,7.6 (79K),"A biography of Chinese Martial Arts Master Huo Yuanjia, who is the founder and spiritual guru of the Jin Wu Sports Federation."
The Whistleblower,tt0896872,2010,1h 52m,15,7.1 (36K),"A drama based on the experiences of Kathryn Bolkovac, a Nebraska cop who served as a peacekeeper in post-war Bosnia and outed the U.N. for covering up a sex trafficking scandal."
Bodyguards and Assassins,tt1403130,2009,2h 19m,15,6.8 (8.7K),"In 1905, revolutionist Sun Yat-Sen visits Hong Kong to discuss plans with Tongmenghui members to overthrow the Qing dynasty. But when they find out that assassins have been sent to kill him, they assemble a group of protectors to prevent any attacks."
Ninja Eliminator 4: The French Connection,tt5479592,2015,8m,N/A,6.5 (43),"Super cops François and Jean-Baptiste are out to find Mr. Mo, the diabolic leader of a ninja drug dealer network."
Chocolate,tt1183252,2008,1h 32m,18,6.9 (19K),An autistic girl with powerful martial art skills looks to settle her ailing mother's debts by seeking out the ruthless gangs that owe her family money.
The Blade,tt0112800,1995,1h 45m,18,7.0 (3.7K),"A swordsmith trains his friend's orphaned son. The boy seeks revenge for his father's murder but loses an arm rescuing the swordsmith's daughter. A hermit girl nurses him, and he learns swordsmanship with his father's broken sword."
Clash of the Titans,tt0082186,1981,1h 58m,12,6.9 (49K),Perseus must battle Medusa and the Kraken to save the Princess Andromeda.
Solomon Kane,tt0970452,2009,1h 44m,15,6.1 (78K),"A ruthless mercenary renounces violence after learning his soul is bound for hell. When a young girl is kidnapped and her family slain by a sorcerer's murderous cult, he is forced to fight and seek his redemption slaying evil."
Assassin's Creed,tt2094766,2016,1h 55m,PG-13,5.6 (212K),"Callum Lynch explores the memories of his ancestor Aguilar de Nerha and gains the skills of a Master Assassin, before taking on the secret Templar society."
The 13th Warrior,tt0120657,1999,1h 42m,15,6.6 (134K),"A man, having fallen in love with the wrong woman, is sent by the sultan himself on a diplomatic mission to a distant land as an ambassador. Stopping at a Viking village port to restock on supplies, he finds himself unwittingly embroiled in a quest to banish a mysterious threat in a distant Viking land."
The Expatriate,tt1645155,2012,1h 40m,15,6.0 (33K),"An ex-CIA agent and his estranged daughter are forced on the run when his employers erase all records of his existence, and mark them both for termination as part of a wide-reaching international conspiracy."
Rurouni Kenshin,tt1979319,2012,2h 14m,15,7.4 (30K),A former assassin who has resolved to never kill again has his vow sorely tested.
My Lucky Stars,tt0089177,1985,1h 39m,PG-13,6.3 (6.2K),"Muscles, cop from Hong Kong, is in Japan chasing a bad HK cop. His cop partner gets taken by the ninja gang. Muscles gets his 5 old no-good friends from the orphanage to help find the bad cop. Lots of comedy and kung-fu fighting follows."
Gangster Squad,tt1321870,2013,1h 53m,15,6.7 (225K),"It's 1949 Los Angeles, the city is run by gangsters and a malicious mobster, Mickey Cohen. Determined to end the corruption, John O'Mara assembles a team of cops, ready to take down the ruthless leader and restore peace to the city."
Cowboys & Aliens,tt0409847,2011,1h 59m,12A,6.0 (235K),"A spaceship arrives in 1873 Arizona to take over the Earth, starting with the Wild West region. All that stands in their way: a posse of cowboys and natives."
Four Brothers,tt0430105,2005,1h 49m,15,6.8 (162K),"When their adoptive mother is gunned down in a store robbery, four brothers decide to investigate the murder and find the killers themselves, but not all is what it seems."
Demolition Man,tt0106697,1993,1h 55m,15,6.7 (199K),A police officer is brought out of suspended animation in prison to pursue an old ultra-violent nemesis who is loose in a non-violent future society.
Showdown in Little Tokyo,tt0102915,1991,1h 19m,18,6.1 (21K),"Two L.A. cops with opposing views on what is the best way to uphold the law have to work together to bring down the Yakuza, while trying to protect a beautiful woman."
The Legend of Billie Jean,tt0089470,1985,1h 36m,15,6.6 (12K),"With her brother falsely accused of attempted murder, a blonde Texas teenage stunner---victim herself of attempted assault---becomes a famous outlaw martyr, as both of them run away with friends, and try to clear their name."
Marked for Death,tt0100114,1990,1h 33m,15,5.9 (25K),A retired DEA agent is out to hunt down and take out a Jamaican drug posse that has targeted he and his family for murder.
Bei po,tt0081539,1977,1h 34m,R,6.3 (249),Two illegal immigrants meet a young kid and the three become best friends until one of them joins the Triads. Now the remaining two must fight the Triads in a battle to the death.
We're Fighting Back,tt0083317,1981,1h 33m,Not Rated,6.6 (88),A group of city youth decide to form a neighborhood watch and clean their streets and the subway from criminals who rob and abuse the good people every night and day.
Point of No Return,tt0107843,1993,1h 49m,18,6.1 (31K),A government fakes the death of a criminal to turn this young woman into a killer on its service.
Man on a Ledge,tt1568338,2012,1h 42m,12A,6.6 (160K),"As a police psychologist works to talk down an ex-con who is threatening to jump from a Manhattan hotel rooftop, the biggest diamond heist ever committed is in motion."
Valhalla Rising,tt0862467,2009,1h 33m,15,6.0 (65K),"Forced for some time to be a fighting slave, a pagan warrior escapes his captors with a boy and joins a group of Crusaders on their quest to the Holy Land."
47 Ronin,tt1335975,2013,2h 8m,12A,6.2 (174K),A band of samurai sets out to avenge the death and dishonor of their master at the hands of a ruthless shogun.
Red Dawn,tt0087985,1984,1h 54m,15,6.3 (65K),"It is the dawn of World War III. In the western mountains of America, a group of teenagers band together to defend their town, and their country, from invading Soviet forces."
T Is for Turbo,tt2622504,2011,6m,N/A,7.0 (756),"From the ashes of a true hero--the technologically-advanced, Turbo Rider--a modern defender shall rise in a post-apocalyptic 1997, when Kid, a die-hard comic aficionado, stumbles upon his beloved idol's high-tech justice-enforcing gear."
Lockout,tt1592525,2012,1h 35m,15,6.0 (102K),A man wrongly convicted of conspiracy to commit espionage against the U.S. is offered his freedom if he can rescue the President's daughter from an outer-space prison taken over by violent inmates.
Once Upon a Time in Mexico,tt0285823,2003,1h 42m,15,6.3 (172K),"Hitman ""El Mariachi"" becomes involved in international espionage involving a psychotic CIA agent and a corrupt Mexican general."
Clash of the Titans,tt0800320,2010,1h 46m,12A,5.8 (296K),"Perseus, a demigod and the son of Zeus, battles the minions of Hades and the Underworld in order to stop them from conquering Olympus and Earth."
Teenage Mutant Ninja Turtles,tt1291150,2014,1h 41m,12A,5.8 (223K),"When a kingpin threatens New York City, a group of mutated turtle warriors must emerge from the shadows to protect their home."
Safe,tt1656190,2012,1h 34m,15,6.5 (120K),"Mei, a young girl whose memory holds a priceless numerical code, finds herself pursued by the Triads, the Russian mob, and corrupt NYC cops. Coming to her aid is an ex-cage fighter whose life was destroyed by the gangsters on Mei's trail."
The Dead Lands,tt3399916,2014,1h 47m,15,6.3 (5.3K),"After his tribe is slaughtered through an act of treachery, the teenage son of a slain Maori chieftain looks to avenge his father's murder and bring peace and honor to the souls of his loved ones."
Colombiana,tt1657507,2011,1h 48m,15,6.4 (110K),A professional assassin seeks revenge for the murder of her parents.
Legacy of Rage,tt0091428,1986,1h 30m,18,6.0 (1.6K),"Brandon Ma is an average Joe but his best friend, Michael, is a sinister drug dealer with a crush on Brandon's girlfriend, May. When Michael murders a dirty cop and frames his friend, sending him to jail, Brandon returns for vengeance."
I Am Number Four,tt1464540,2011,1h 51m,PG,6.1 (248K),"Aliens and their Guardians are hiding on Earth from intergalactic bounty hunters. They can only be killed in numerical order, and Number Four is next on the list. This is his story."
Immortals,tt1253864,2011,1h 50m,15,6.0 (178K),"Theseus is a mortal man chosen by Zeus to lead the fight against the ruthless King Hyperion, who is on a rampage across Greece to obtain a weapon that can destroy humanity."
Knight and Day,tt1013743,2010,1h 49m,12A,6.3 (213K),A young woman gets mixed up with a disgraced spy who is trying to clear his name.
Lucy,tt2872732,2014,1h 29m,15,6.4 (547K),"A woman, accidentally caught in a dark deal, turns the tables on her captors and transforms into a merciless warrior evolved beyond human logic."
Violet & Daisy,tt1634136,2011,1h 28m,15,6.0 (13K),"Two teenage assassins accept what they think will be a quick-and-easy job, until an unexpected target throws them off their plan."
Remo: Unarmed and Dangerous,tt0089901,1985,2h 1m,15,6.4 (14K),"An officially ""dead"" cop is trained to become an extraordinary unique assassin in service of the US President."
John Carter,tt0401729,2012,2h 12m,12A,6.6 (290K),A war-weary former army captain is inexplicably transported to Mars and reluctantly becomes embroiled in a conflict of epic proportions.
Hercules,tt1267297,2014,1h 38m,12A,6.0 (167K),"Having endured his legendary twelve labors, Hercules, the Greek demigod, has his life as a sword-for-hire tested when the King of Thrace and his daughter seek his aid in defeating a tyrannical warlord."
Hummingbird,tt1893256,2013,1h 40m,15,6.2 (78K),A damaged ex-special forces soldier navigating London's criminal underworld seizes an opportunity to assume another man's identity.
Suicide Squad,tt1386697,2016,2h 3m,15,5.9 (733K),A secret government agency recruits some of the most dangerous incarcerated super-villains to form a defensive task force. Their first mission: save the world from the apocalypse.
Last Man Standing,tt0116830,1996,1h 41m,18,6.4 (62K),A drifting gunslinger-for-hire finds himself in the middle of an ongoing war between the Irish and Italian mafia in a Prohibition era ghost town.
The Grandmaster,tt1462900,2013,2h 10m,15,6.6 (37K),"The story of martial-arts master Ip Man, the man who trained Bruce Lee."
Chaos,tt0402910,2005,1h 46m,15,6.4 (59K),"Two cops, a rookie and a grizzled vet, pursue an accomplished bank robber."
Faster,tt1433108,2010,1h 38m,15,6.4 (113K),An ex-con gets on a series of apparently unrelated killings. He gets tracked by a veteran cop with secrets of his own and an egocentric hit man.
Judgment Night,tt0107286,1993,1h 50m,18,6.6 (19K),"Four young friends, while taking a shortcut en route to a local boxing match, witness a brutal murder which leaves them running for their lives."
Kickboxer,tt0097659,1989,1h 37m,18,6.4 (63K),Kurt Sloane must learn the ancient kick boxing art of Muay Thai in order to avenge his brother.
The Running Man,tt0093894,1987,1h 41m,18,6.6 (172K),"In a dystopian America, a falsely convicted policeman gets his shot at freedom when he must forcibly participate in a TV game show where convicts, runners, must battle killers for their freedom."
Harsh Times,tt0433387,2005,1h 56m,15,6.8 (69K),A tough-minded drama about two friends in South Central Los Angeles and the violence that comes between them.
Revenge of the Ninja,tt0086192,1983,1h 30m,R,6.0 (6K),"After ninjas killed his family, Cho and his son Kane come to America to start a new life. He opens a doll shop but is unwittingly importing heroin in the dolls. When his friend betrays him, Cho must prepare for the ultimate battle."
Spooks: The Greater Good,tt3321300,2015,1h 44m,15,6.2 (24K),"When a terrorist escapes custody during a routine handover, Will Holloway must team with disgraced MI5 Intelligence Chief Harry Pearce to track him down before an imminent terrorist attack on London."
Crying Freeman,tt0112750,1995,1h 42m,18,6.4 (14K),A woman sees an assassin outside San Francisco killing yakuza men and later in Vancouver. She's been told that he leaves no witness. Will she be his next victim or...?
Revolver,tt0365686,2005,1h 51m,15,6.3 (105K),Gambler Jake Green enters into a game with potentially deadly consequences.
The Fast and the Furious,tt0232500,2001,1h 46m,15,6.8 (429K),Los Angeles police officer Brian O'Conner must decide where his loyalty really lies when he becomes enamored with the street racing world he has been sent undercover to end it.
The Admiral: Roaring Currents,tt3541262,2014,2h 8m,15,7.1 (13K),Admiral Yi Sun-sin faces a tough challenge when he is forced to defend his nation with just 13 battleships against 300 Japanese enemy ships in the Battle of Myeongryang.
Free Fire,tt4158096,2016,1h 31m,15,6.3 (52K),"Set in Boston in 1978, a meeting in a deserted warehouse between two gangs turns into a shoot-out and a game of survival."
John Wick: Chapter 2,tt4425200,2017,2h 2m,18,7.4 (527K),"After returning to the criminal underworld to repay a debt, John Wick discovers that a large bounty has been put on his life."
Logan,tt3315342,2017,2h 17m,15,8.1 (869K),"In a future where mutants are nearly extinct, an elderly and weary Logan leads a quiet life. But when Laura, a mutant child pursued by scientists, comes to him for help, he must get her to safety."
Dunkirk,tt5013056,2017,1h 46m,12A,7.8 (758K),"Allied soldiers from Belgium, the British Commonwealth and Empire, and France are surrounded by the German Army and evacuated during a fierce battle in World War II."
Baby Driver,tt3890160,2017,1h 53m,15,7.5 (633K),"Coerced into working for a crime boss, a young getaway driver must face the music when a doomed heist threatens his life, love, and freedom."
Atomic Blonde,tt2406566,2017,1h 55m,15,6.7 (211K),An undercover MI6 agent is sent to Berlin during the Cold War to investigate the murder of a fellow agent and recover a missing list of double agents.
War for the Planet of the Apes,tt3450958,2017,2h 20m,12A,7.4 (310K),"After the apes suffer unimaginable losses, Caesar wrestles with his darker instincts and begins his own mythic quest to avenge his kind."
The Age of Shadows,tt4914580,2016,2h 20m,15,7.1 (11K),Korean resistance fighters smuggle explosives to destroy facilities controlled by Japanese forces in this period action thriller.
Mesrine Part 1: Killer Instinct,tt1259014,2008,1h 53m,15,7.5 (36K),"The story of the notorious French gangster Jacques Mesrine, with the focus on his life before the early 1970s and the events that led to him being declared Public Enemy No. 1 in France."
The Siege of Jadotville,tt3922798,2016,1h 48m,15,7.2 (45K),Irish Commandant Pat Quinlan leads a stand off with troops against French and Belgian Mercenaries in the Congo during the early 1960s.
The Master,tt4851640,2015,1h 49m,15,6.8 (2.9K),"A Wing Chun master has to defeat 8 martial arts schools to open his own school, yet he has become a chess piece to the local power dynamics."
'71,tt2614684,2014,1h 39m,15,7.2 (62K),"In 1971, a young and disoriented British soldier is accidentally abandoned by his unit following a riot on the deadly streets of Belfast."
A Bout Portant - Point Blank,tt1545759,2010,1h 24m,15,6.8 (15K),"Samuel, a male nurse, saves the life of a thief whose henchmen take Samuel's wife hostage and force him to spring their boss."
Brotherhood,tt0386064,2004,2h 20m,R,8.0 (41K),"When two brothers are forced to fight in the Korean War, the elder decides to take the riskiest missions if it will help shield the younger from battle."
A Bittersweet Life,tt0456912,2005,1h 59m,18,7.5 (44K),Things go wrong for a high ranking mobster when he doesn't follow his boss's orders.
Blood and Bone,tt0346631,2009,1h 33m,18,6.7 (36K),"In Los Angeles, an ex-con takes the underground fighting world by storm in his quest to fulfill a promise to a dead friend."
Election,tt0434008,2005,1h 41m,18,7.1 (12K),Rival gang leaders are locked in a struggle to become the new chairman of Hong Kong's Triad society.
Pusher II,tt0396184,2004,1h 40m,18,7.3 (26K),"Tonny is released from prison - again. This time he has his mind set on changing his broken down life, but that is easier said than done."
Pusher III,tt0425379,2005,1h 48m,18,7.3 (19K),"Milo tries to be a family man and run his criminal organization, but a wrong drug shipment endangers everything."
The Villainess,tt6777338,2017,2h 4m,18,6.6 (17K),A female assassin leaves a trail of bodies behind her as she seeks revenge.
Welcome to the Jungle,tt0327850,2003,1h 44m,15,6.7 (145K),A tough aspiring chef is hired to bring home a mobster's son from the Amazon but becomes involved in the fight against an oppressive town operator and the search for a legendary treasure.
A Hard Day,tt3697626,2014,1h 51m,15,7.2 (17K),"After trying to cover up a car accident that left a man dead, a crooked homicide detective is stalked by a mysterious man claiming to have witnessed the event."
Boy Wonder,tt1456060,2010,1h 37m,15,6.8 (9.6K),"A traumatized boy grows into a shy, determined teenager who patrols the mean streets of New York City, helping those in need and dishing out severe punishment to remorseless thugs."
Baahubali: The Beginning,tt2631186,2015,2h 39m,15,8.0 (141K),"A child from the Mahishmati kingdom is raised by tribal people and one day learns about his royal heritage, his father's bravery in battle and a mission to overthrow the incumbent ruler."
Baahubali 2: The Conclusion,tt4849438,2017,2h 47m,15,8.2 (119K),"Amarendra Baahubali, the heir apparent to the throne of Mahishmati, finds his life and relationships endangered as his adoptive brother Bhallaladeva conspires to claim the throne."
Baby,tt3848892,2015,2h 39m,15,7.9 (61K),"An elite counter-intelligence unit learns of a plot, masterminded by a maniacal madman. With the clock ticking, it's up to them to track the terrorists' international tentacles and prevent them from striking at the heart of India."
The Count of Monte Cristo,tt0245844,2002,2h 11m,PG,7.7 (152K),"A young man, falsely imprisoned by his jealous ""friend"", escapes and uses a hidden treasure to exact his revenge."
New Police Story,tt0386005,2004,2h 3m,15,6.9 (30K),"A hero cop accidentally leads his team into a trap from which he is the only survivor. Drowning his guilt in booze, he is eventually assigned a new younger partner who turns out to have his own secrets."
A Dirty Carnival,tt0821442,2006,2h 20m,Not Rated,7.3 (9.4K),A small time thug collecting debts for the local triad is torn between his criminal aspirations and his devotion to family.
Fortress of War,tt1343703,2010,2h 18m,15,7.4 (11K),"A war drama set during the Nazi invasion of the Soviet Union in June 1941, in which Soviet troops held on to a border stronghold for nine days."
Crows Zero,tt1016290,2007,2h 10m,15,7.0 (9.1K),"A transfer student attempts to take over the most violent high school in the country, whose students form factions and battle each other for power."
Kurôzu zero II,tt1232831,2009,2h 13m,15,7.2 (5.6K),Tension escalates and violence ensues when a young student unwittingly breaks a non-aggression pact between two rival high schools.
Reign of Assassins,tt1460743,2010,1h 57m,15,6.8 (9.2K),Drizzle/Zeng Jing tries to start a new life after she had betrayed her gang and hid the remains of monk.
O Homem do Ano,tt0312773,2003,1h 45m,15,7.1 (3.2K),Maiquel has lost a bet and dyed his hair blond. This little event triggers a head-on collision with destiny in which Maiquel goes from nobody to hero to outlaw--all in 24 hours.
